Movie_name,Original_Title,Release_date,Release_year,Release_decade,Genre,Runtime_minutes,Director,Top_Actors,Actor_count,Overview,Budget,Budget_category,Revenue,Profit,ROI,Is_profitable,Rating,Rating_category,Poster_URL,Source
Willard,Willard,"Mar 14, 2003",2003,2000s,"Drama, Horror, Thriller",96.0,Glen Morgan,"Crispin Glover, R. Lee Ermey, Laura Harring, Jackie Burroughs, Ashlyn Gere",5,"Solitaire, timoré, timide, mal dans sa peau, Willard mène une vie misérable entre la maison familiale et un travail inintéressant. Il se découvre un jour un étrange don de séduction auprès des rongeurs qui habitent les fondations de sa demeure. Willard a enfin des amis. Des centaines d'amis. Des compagnons qui lui obéissent au doigt et à l'oeil, et qu'il va utiliser pour se venger des reproches que lui adresse Frank Martin, son nouveau patron...",2200000000.0,High (>100M),856458600.0,-1343541400.0,-0.61,False,61,Excellent (8+),https://media.themoviedb.org/t/p/w220_and_h330_face/hRVP8Ud9ehv7tp5WWQ4CHk2XNus.jpg,TMDb
Ne Zha,Ne Zha,"Aug 29, 2019",2019,2010s,"Adventure, Animation, Fantasy",110.0,Jiao Zi,"Lu Yanting, Joseph, Han Mo, Chen Hao, Lu Qi",5,"Ne zha, un jeune garçon, est né d'une perle céleste du Seigneur du ciel. Doté de pouvoirs uniques, il se retrouve à vivre comme un paria, détesté et craint. Destiné par la prophétie à détruire le monde, il doit choisir entre le bien et le mal afin de briser les chaînes du destin et devenir un héros.",2200000000.0,High (>100M),74271849600.0,72071849600.0,32.76,True,79,Excellent (8+),https://media.themoviedb.org/t/p/w220_and_h330_face/phM9bb6s9c60LA8qwsdk7U1N2cS.jpg,TMDb
28 Weeks Later,28 Weeks Later,"May 11, 2007",2007,2000s,"Horror, Thriller",96.0,Juan Carlos Fresnadillo,"Robert Carlyle, Rose Byrne, Jeremy Renner, Harold Perrineau, Catherine McCormack",5,"Il y a 6 mois, un virus a décimé l'Angleterre, transformant la population en monstres sanguinaires. Aujourd'hui, la situation est maîtrisée et Londres contrôlée par l'armée de l'OTAN sous commandement américain, et les rares survivants reviennent dans les quartiers sécurisés de la ville. Don a échappé de justesse a une attaque de zombies en s'enfuyant sous les yeux de sa femme, qui elle, n'a pas eu sa chance. Il retrouve ses enfants à Londres. Alors qu'ils tentent de se reconstruire, quelque part, un effroyable secret les attend. Tout n'est pas terminé…",1500000000.0,High (>100M),7230484600.0,5730484600.0,3.82,True,66,Excellent (8+),https://media.themoviedb.org/t/p/w220_and_h330_face/oix0aNv1lvW3nUGspUyvSIBlpbs.jpg,TMDb
Princess Mononoke,Princess Mononoke,"Oct 29, 1999",1999,1990s,"Adventure, Animation, Fantasy",135.0,Hayao Miyazaki,"Yōji Matsuda, Yuriko Ishida, Yuko Tanaka, Kaoru Kobayashi, Masahiko Nishimura",5,"Parti en quête d'un remède, un prince affecté par un mal fatal se retrouve dans une contrée où se livre une bataille entre une ville minière et les animaux de la forêt.",2350000000.0,High (>100M),17650618600.0,15300618600.0,6.51,True,83,Excellent (8+),https://media.themoviedb.org/t/p/w220_and_h330_face/cMYCDADoLKLbB83g4WnJegaZimC.jpg,TMDb
The Usual Suspects,The Usual Suspects,"Aug 16, 1995",1995,1990s,"Crime, Drama, Thriller",106.0,Bryan Singer,"Stephen Baldwin, Gabriel Byrne, Benicio del Toro, Kevin Pollak, Kevin Spacey",5,"Suspect numéro 1 dans une étrange affaire de hold-up, Verbal Kint est soumis à un interrogatoire par des agents fédéraux. Très vite, il dévoile aux policiers que le véritable cerveau de cette affaire n'est autre que le redoutable criminel Keyser Soze, un être machiavélique possédant une intelligence hors du commun. Peu à peu, le suspect va dresser un portrait effrayant de ce criminel que personne n'a jamais vu…",600000000.0,High (>100M),2330000000.0,1730000000.0,2.88,True,82,Excellent (8+),https://media.themoviedb.org/t/p/w220_and_h330_face/99X2SgyFunJFXGAYnDv3sb9pnUD.jpg,TMDb
Jurassic World,Jurassic World,"Jun 12, 2015",2015,2010s,"Action, Adventure, Thriller",125.0,Colin Trevorrow,"Chris Pratt, Bryce Dallas Howard, Irrfan Khan, Vincent D'Onofrio, Ty Simpkins",5,"Après le décès de son fondateur John Hammond, la société de biotechnologie InGen a été rachetée par Simon Masrani, PDG de la Masrani Global Corporation. Deux décennies après les événements tragiques de 1993, un nouveau parc a ouvert ses portes sur Isla Nublar, au large du Costa Rica. C’est plus de vingt mille visiteurs qui débarquent chaque jour à « Jurassic World », le « plus grand parc à thèmes jamais construit dans l’histoire humaine » pour profiter pleinement du cadre idyllique de l’île et de ses attractions. Les scientifiques de la réserve biologique, sous la direction du Dr Henry Wu, étudient le comportement des animaux, des dinosaures vivants recréés à partir de leur ADN fossilisé dans de lʼambre. Mais alors que tout le monde croyait les leçons du passé assimilées, un nouvel incident éclate…",15000000000.0,High (>100M),167153744400.0,152153744400.0,10.14,True,67,Excellent (8+),https://media.themoviedb.org/t/p/w220_and_h330_face/rhr4y79GpxQF9IsfJItRXVaoGs4.jpg,TMDb
Eternals,Eternals,"Nov 05, 2021",2021,2020s,"Action, Adventure",156.0,Chloé Zhao,"Gemma Chan, Richard Madden, Angelina Jolie, Salma Hayek Pinault, Kumail Nanjiani",5,"Les Éternels, un groupe de héros venus des confins du cosmos, veillent sur la Terre depuis l’aube de l’humanité. La réapparition mystérieuse des Déviants, des créatures monstrueuses censées avoir disparu depuis des siècles, contraint les Éternels à se retrouver pour défendre une fois de plus l’humanité.",23620000000.0,High (>100M),40206489900.0,16586489900.0,0.7,True,68,Excellent (8+),https://media.themoviedb.org/t/p/w220_and_h330_face/lFByFSLV5WDJEv3KabbdAF959F2.jpg,TMDb
The Godfather Part III,The Godfather Part III,"Dec 25, 1990",1990,1990s,"Crime, Drama, Thriller",160.0,Francis Ford Coppola,"Al Pacino, Diane Keaton, Talia Shire, Andy Garcia, Eli Wallach",5,"Atteignant la soixantaine, Michael Corleone désire à la fois renouer avec les siens et se réhabiliter aux yeux de la société, surtout de l'Église. Il arrivera presque à ses fins, mais sa vie passée et ses anciens ennemis le rattraperont plus vite. Michael Corleone est fatigué. Il veut prendre ses distances avec les activités mafieuses de sa famille. Il veut convertir ces activités en affaires légales. Kay, son ex-femme, lui fait même accepter que leur fils devienne un chanteur d'opéra et ne reprenne pas les activités familiales. Pendant ce temps, la fille de Michael, Mary, et son neveu, le fils de Sonny, Vincent, nouent une idylle qui n'est pas la bienvenue dans la famille. Il décide d'aider le Vatican à renflouer ses caisses et reçoit en échange le contrôle d'une entreprise immobilière leur appartenant. Attisant la jalousie de ses pairs, Michael échappe de justesse à un attentat commis par l'un d'eux. Vincent se propose alors pour reprendre les affaires de la famille en main.",5400000000.0,High (>100M),13676606200.0,8276606200.0,1.53,True,74,Excellent (8+),https://media.themoviedb.org/t/p/w220_and_h330_face/lm3pQ2QoQ16pextRsmnUbG2onES.jpg,TMDb
Aquaman,Aquaman,"Dec 21, 2018",2018,2010s,"Action, Adventure, Fantasy",143.0,James Wan,"Jason Momoa, Amber Heard, Willem Dafoe, Patrick Wilson, Nicole Kidman",5,"Personnage légendaire depuis 70 ans, Aquaman est le Roi des Sept Mers, régnant à contrecœur sur Atlantis. Pris en étau entre les Terriens qui détruisent constamment la mer et les habitants d'Atlantis prêts à se révolter, Aquaman doit protéger la planète tout entière…",16000000000.0,High (>100M),115202839300.0,99202839300.0,6.2,True,69,Excellent (8+),https://media.themoviedb.org/t/p/w220_and_h330_face/ufl63EFcc5XpByEV2Ecdw6WJZAI.jpg,TMDb
Alien: Covenant,Alien: Covenant,"May 19, 2017",2017,2010s,Horror,122.0,Dan O'Bannon,"Michael Fassbender, Katherine Waterston, Billy Crudup, Danny McBride, Demián Bichir",5,"Les membres d’équipage du vaisseau Covenant, à destination d’une planète située au fin fond de notre galaxie, découvrent ce qu’ils pensent être un paradis encore intouché. Il s’agit en fait d’un monde sombre et dangereux, cachant une menace terrible. Ils vont tout tenter pour s’échapper.",9700000000.0,High (>100M),24089176300.0,14389176300.0,1.48,True,62,Excellent (8+),https://media.themoviedb.org/t/p/w220_and_h330_face/zecMELPbU5YMQpC81Z8ImaaXuf9.jpg,TMDb
The Revenant,The Revenant,"Dec 25, 2015",2015,2010s,"Adventure, Drama, Western",157.0,Alejandro González Iñárritu,"Leonardo DiCaprio, Tom Hardy, Domhnall Gleeson, Will Poulter, Forrest Goodluck",5,"Dans une Amérique profondément sauvage, le trappeur Hugh Glass est sévèrement blessé et laissé pour mort par un traître de son équipe, John Fitzgerald. Avec sa seule volonté pour unique arme, Glass doit affronter un environnement hostile, un hiver brutal et des tribus guerrières, dans une inexorable lutte pour sa survie, portée par un intense désir de vengeance.",13500000000.0,High (>100M),53295050300.0,39795050300.0,2.95,True,75,Excellent (8+),https://media.themoviedb.org/t/p/w220_and_h330_face/ji3ecJphATlVgWNY0B0RVXZizdf.jpg,TMDb
Spectre,Spectre,"Nov 06, 2015",2015,2010s,"Action, Adventure, Thriller",148.0,Ian Fleming,"Daniel Craig, Christoph Waltz, Léa Seydoux, Ralph Fiennes, Monica Bellucci",5,"Un message cryptique surgi du passé entraîne James Bond dans une mission très personnelle à Mexico puis à Rome, où il rencontre Lucia Sciarra, la très belle veuve d’un célèbre criminel. Bond réussit à infiltrer une réunion secrète révélant une redoutable organisation baptisée Spectre. Pendant ce temps, à Londres, Max Denbigh, le nouveau directeur du Centre pour la Sécurité Nationale, remet en cause les actions de Bond et l’existence même du MI6, dirigé par M. Bond persuade Moneypenny et Q de l’aider secrètement à localiser Madeleine Swann, la fille de son vieil ennemi, Mr White, qui pourrait détenir le moyen de détruire Spectre. Fille de tueur, Madeleine comprend Bond mieux que personne… En s’approchant du cœur de Spectre, Bond va découvrir qu’il existe peut-être un terrible lien entre lui et le mystérieux ennemi qu’il traque…",24500000000.0,High (>100M),88070759700.0,63570759700.0,2.59,True,66,Excellent (8+),https://media.themoviedb.org/t/p/w220_and_h330_face/zj8ongFhtWNsVlfjOGo8pSr7PQg.jpg,TMDb
Taken,Taken,"Jan 30, 2009",2009,2000s,"Action, Thriller",94.0,Pierre Morel,"Liam Neeson, Maggie Grace, Famke Janssen, Olivier Rabourdin, Leland Orser",5,"Que peut-on imaginer de pire pour un père que d'assister impuissant à l'enlèvement de sa fille via un téléphone portable ? C'est le cauchemar vécu par Bryan, ancien agent des services secrets américains, qui n'a que quelques heures pour arracher Kim des mains d'un redoutable gang spécialisé dans la traite des femmes. Premier problème à résoudre : il est à Los Angeles, elle vient de se faire enlever à Paris.",2500000000.0,High (>100M),22683056800.0,20183056800.0,8.07,True,74,Excellent (8+),https://media.themoviedb.org/t/p/w220_and_h330_face/ognkaUSNgJe1a2pjB4UNdzEo5jT.jpg,TMDb
Bosomy Mom 2,Bosomy Mom 2,"May 27, 2020",2020,2020s,Romance,69.0,Lee Dong-Joon,"Yoo Jung, Han Yi-seul, James, Shin Yeon-woo",4,"Min-soo and Jae-hyeok is in a good father-and-son relationship. But one day, Min-soo brings Jae-hyeok's young stepmother, Da-hee. Jae-hyeok leaves home to wander around, ran into Da-hee's friend, Na-yeon, and had a little talk. Na-yeon calls Da-hee... Da-hee goes home with Jae-hyeok, and Min-soo doesn't care much. Jae-hyeok tells Da-hee how he feels. Meanwhile, Min-soo who disapproves Da-hee and Jae-hyeok's relationship, calls Na-yeon to kill some time. And Na-yeon who is worried about Da-hee and Min-soo crafts a new plan...",,Unknown,,,,,44,Excellent (8+),https://media.themoviedb.org/t/p/w220_and_h330_face/3qotZafIXzrgq7SUmHsBY6onRcU.jpg,TMDb
Sisu,Sisu,"Apr 28, 2023",2023,2020s,"Action, Thriller, War",91.0,Jalmari Helander,"Jorma Tommila, Aksel Hennie, Jack Doolan, Mimosa Willamo, Onni Tommila",5,"1944, en Laponie finlandaise, un ancien soldat reconverti en chercheur d'or trouve une grande quantité d'or. En essayant de rapporter son butin en ville, il devra se battre contre les forces nazies présentes en Finlande.",660000000.0,High (>100M),1428119900.0,768119900.0,1.16,True,74,Excellent (8+),https://media.themoviedb.org/t/p/w220_and_h330_face/ygO9lowFMXWymATCrhoQXd6gCEh.jpg,TMDb
Anyone But You,Anyone But You,"Dec 22, 2023",2023,2020s,"Comedy, Romance",103.0,Will Gluck,"Sydney Sweeney, Glen Powell, Mia Artemis, Nat Buchanan, GaTa",5,"Bea et Ben ont tout du couple parfait, mais après un premier rendez-vous idéal, un incident refroidit leur attirance réciproque jusqu'à leurs retrouvailles inattendues lors d'un mariage en Australie. Ils font alors ce que n'importe quel adulte mature ferait dans cette situation : prétendre être en couple.",2500000000.0,High (>100M),21489137000.0,18989137000.0,7.6,True,68,Excellent (8+),https://media.themoviedb.org/t/p/w220_and_h330_face/5qHoazZiaLe7oFBok7XlUhg96f2.jpg,TMDb
The Strangers: Chapter 2,The Strangers: Chapter 2,"Sep 26, 2025",2025,2020s,"Horror, Thriller",98.0,Bryan Bertino,"Madelaine Petsch, Froy Gutierrez, Gabriel Basso, Ema Horvath, Brooke Lena Johnson",5,"Lorsqu’ils découvrent que l’une de leurs victimes, Maya, a survécu, ils reviennent pour terminer ce qu’ils ont commencé. Traquée et isolée, Maya doit affronter un nouveau chapitre terrifiant alors que les tueurs, insensés et inarrêtables, la traquent, prêts à éliminer quiconque se mettra en travers de leur route.",800000000.0,High (>100M),2192174900.0,1392174900.0,1.74,True,61,Excellent (8+),https://media.themoviedb.org/t/p/w220_and_h330_face/aEk9jLbiKTVssdATbrF879NvyyJ.jpg,TMDb
Turning Red,Turning Red,"Feb 09, 2024",2024,2020s,"Animation, Comedy, Fantasy",100.0,Domee Shi,"Rosalie Chiang, Sandra Oh, Ava Morse, Hyein Park, Maitreyi Ramakrishnan",5,"Les aventures de Meilin Lee, une jeune adolescente de 13 ans, pleine d’assurance, mais tiraillée entre son image de petite fille modèle aux yeux de sa mère hyper protectrice et le chaos de l’adolescence. Et comme si tous les changements qui s’opèrent en elle ne suffisaient pas, chaque fois qu’elle est débordée par ses émotions - ce qui, pour une ado, arrive quasiment tout le temps - elle se transforme en panda roux géant !",,Unknown,2181335800.0,,,,73,Excellent (8+),https://media.themoviedb.org/t/p/w220_and_h330_face/qsdjk9oAKSQMWs0Vt5Pyfh6O4GZ.jpg,TMDb
John Wick: Chapter 3 - Parabellum,John Wick: Chapter 3 - Parabellum,"May 17, 2019",2019,2010s,"Action, Crime, Thriller",130.0,Derek Kolstad,"Keanu Reeves, Halle Berry, Ian McShane, Laurence Fishburne, Mark Dacascos",5,"John Wick a transgressé une règle fondamentale : il a tué à l’intérieur même de l’Hôtel Continental. ""Excommunié"", tous les services liés au Continental lui sont fermés et sa tête mise à prix. John se retrouve sans soutien, traqué par tous les plus dangereux tueurs du monde.",5500000000.0,High (>100M),32670972700.0,27170972700.0,4.94,True,74,Excellent (8+),https://media.themoviedb.org/t/p/w220_and_h330_face/ziEuG1essDuWuC5lpWUaw1uXY2O.jpg,TMDb
The Grand Budapest Hotel,The Grand Budapest Hotel,"Mar 07, 2014",2014,2010s,"Comedy, Drama",100.0,Wes Anderson,"Ralph Fiennes, F. Murray Abraham, Mathieu Amalric, Adrien Brody, Willem Dafoe",5,"Pendant l’entre‐deux guerres, le légendaire concierge d’un grand hôtel et son jeune protégé se retrouvent impliqués dans une histoire mêlant le vol d’un tableau de la Renaissance, la bataille pour une énorme fortune familiale, et le lent puis soudain bouleversement qui transforme l’Europe en cette première moitié de XXème siècle.",3000000000.0,High (>100M),17460031800.0,14460031800.0,4.82,True,80,Excellent (8+),https://media.themoviedb.org/t/p/w220_and_h330_face/eWdyYQreja6JGCzqHWXpWHDrrPo.jpg,TMDb
The Singers,The Singers,"Mar 08, 2025",2025,2020s,"Comedy, Drama, Music",17.0,Sam Davis,N/A,0,"Dans ce court-métrage nommé aux Oscars, une compétition de chant improvisée dans un bar de quartier transforme une nuit de solitude en un moment d'harmonie et de partage.",,Unknown,,,,,68,Excellent (8+),https://media.themoviedb.org/t/p/w220_and_h330_face/tJ3gevIkQWDXtYj6FvfFilnCfmv.jpg,TMDb
Playing with Love,Playing with Love,"Jul 07, 1977",1977,1970s,Drama,94.0,Pier Giuseppe Murgia,"Lara Wendel, Éva Ionesco, Martin Loeb",3,"Trois adolescents Fabrizio, Laura et Silvia, seuls dans une forêt, se livrent à des jeux érotiques.",,Unknown,,,,,51,Excellent (8+),https://media.themoviedb.org/t/p/w220_and_h330_face/nu5uj47KSF73VPEiIRYdPLJ96j7.jpg,TMDb
World War Z,World War Z,"Jun 21, 2013",2013,2010s,"Action, Horror, Thriller",116.0,Marc Forster,"Brad Pitt, Mireille Enos, Daniella Kertesz, James Badge Dale, Ludi Boeken",5,"Gerry Lane se lance dans une course contre la montre pour aider le monde à surmonter ses divisions et faire face à l'apocalypse. Dans tous les pays, par tous les moyens, chacun devra se battre car l'humanité n'aura plus qu'un seul espoir de survie : La guerre.",20000000000.0,High (>100M),53186500000.0,33186500000.0,1.66,True,68,Excellent (8+),https://media.themoviedb.org/t/p/w220_and_h330_face/aCnVdvExw6UWSeQfr0tUH3jr4qG.jpg,TMDb
Whistle,Whistle,"Feb 06, 2026",2026,2020s,"Horror, Mystery",97.0,Corin Hardy,"Dafne Keen, Sophie Nélisse, Sky Yang, Jhaleil Swaby, Alissa Skovbye",5,"Un groupe de lycéens tombe sur un artefact oublié : un Sifflet de Mort Aztèque. Ils découvrent que souffler dedans libère un son terrifiant, capable d’invoquer leurs morts futures pour les traquer. Alors que le nombre de victimes augmente, les adolescents doivent briser la chaîne de la Mort avant que le dernier écho du sifflet ne scelle leur destin.",200000000.0,High (>100M),72000000.0,-128000000.0,-0.64,False,64,Excellent (8+),https://media.themoviedb.org/t/p/w220_and_h330_face/ieOiiCBbf0SNwR39iiA2xnGOnab.jpg,TMDb
My Friend's Mom,My Friend's Mom,"Oct 12, 2016",2016,2010s,Romance,78.0,Tak Seung-oh,"Lee Eun-mi, Lee Yoo-chan, Kang Ye-na, Je Dong-hwa, Joo Ye-bin",5,"After her mother dies, Young-jae visits her older sister's house, who took care of herself like her, and reunites with her sister, Soon-ae. She is incredibly greedy and charming. With the provocation of Soon-ae, the two develop into a secret relationship. One day when she was having a hot night with her mature lead, her daughter got stuck between the two ...  A young and sexy daughter, a seasoned and mature mother, and a man wandering between mother and daughter.  An unprecedented triangular romance between the three begins.",,Unknown,,,,,45,Excellent (8+),https://media.themoviedb.org/t/p/w220_and_h330_face/19ly5EebC8LlejpbWWSBEMqtJz1.jpg,TMDb
The 33D Invader,The 33D Invader,"Oct 06, 2011",2011,2010s,Comedy,82.0,Cash Chin Man-Kei,"Wu Qing-Qing, Chen Jun-Yan, Akiho Yoshizawa, Taka Katou",4,"A young woman named Future is sent from the year 2046 to the year 2011 in Hong Kong. Future was sent by the United Nations in order to get pregnant, where she can then extract her genes and repopulate the earth as 99% of males have become infertile in the future due to attacks from Planet Xucker. Two assassins from Xuckler are sent after her to stop her. Future meets three University students: Felix, Dan-san and Sing. The men are obsessed with female students next door: Chin-chin, Chen-chen and Sai-sai. The students agree to help Future find a mate at the university.",,Unknown,,,,,56,Excellent (8+),https://media.themoviedb.org/t/p/w220_and_h330_face/bBC1fBHyFBmc6fn4UDedtkOVSaD.jpg,TMDb
Saving Private Ryan,Saving Private Ryan,"Jul 24, 1998",1998,1990s,"Drama, War",169.0,Steven Spielberg,"Tom Hanks, Tom Sizemore, Edward Burns, Barry Pepper, Adam Goldberg",5,"Vue à travers le regard d’une escouade de soldats américains, l’histoire débute le jour du Débarquement au cours de la 2ème Guerre Mondiale, le long des plages de Normandie. Le capitaine John Miller a pour mission de retrouver le soldat James Ryan, dont les trois frères sont morts au combat et il s’expose ainsi à de nombreux risques. Confrontés à une situation périlleuse, les hommes discutent les ordres. Pourquoi huit hommes risqueraient-ils leur vie pour un seul homme ? Rattrapés par la brutalité de la guerre, chacun cherche sa propre réponse ainsi que la force de vaincre un futur incertain avec honneur, décence et courage.",7000000000.0,High (>100M),48184090900.0,41184090900.0,5.88,True,82,Excellent (8+),https://media.themoviedb.org/t/p/w220_and_h330_face/uqx37cS8cpHg8U35f9U5IBlrCV3.jpg,TMDb
Cast Away,Cast Away,"Dec 22, 2000",2000,2000s,"Adventure, Drama",144.0,Robert Zemeckis,"Tom Hanks, Helen Hunt, Chris Noth, Paul Sanchez, Lari White",5,"Chuck Noland, gestionnaire au service d’un transporteur international ne vit que par son travail. Il sillonne le monde pour améliorer les performances de son entreprise et la productivité de ses équipes. Il ne voit sa compagne Kelly que quelques jours par an. Lors de l’un de ses déplacements, Chuck est victime d’un accident d'avion qui coule en plein Pacifique. Agrippé à un radeau de sauvetage, Chuck s’échoue sur un îlot désert. Seul au monde, privé de tous ses repères habituels, le naufragé doit apprendre les gestes élémentaires pour sa survie.",9000000000.0,High (>100M),42963214200.0,33963214200.0,3.77,True,77,Excellent (8+),https://media.themoviedb.org/t/p/w220_and_h330_face/7lLJgKnAicAcR5UEuo8xhSMj18w.jpg,TMDb
Prisoners,Prisoners,"Sep 20, 2013",2013,2010s,"Crime, Drama, Thriller",153.0,Denis Villeneuve,"Hugh Jackman, Jake Gyllenhaal, Viola Davis, Maria Bello, Terrence Howard",5,"Dans la banlieue de Boston, deux fillettes de 6 ans, Anna et Joy, ont disparu. Le détective Loki privilégie la thèse du kidnapping suite au témoignage de Keller, le père d’Anna. Le suspect numéro 1 est rapidement arrêté mais est relâché quelques jours plus tard faute de preuve, entrainant la fureur de Keller. Aveuglé par sa douleur, le père dévasté se lance alors dans une course contre la montre pour retrouver les enfants disparus. De son côté, Loki essaie de trouver des indices pour arrêter le coupable avant que Keller ne commette l’irréparable… Les jours passent et les chances de retrouver les fillettes s’amenuisent…",4600000000.0,High (>100M),12212668700.0,7612668700.0,1.65,True,81,Excellent (8+),https://media.themoviedb.org/t/p/w220_and_h330_face/jsS3a3ep2KyBVmmiwaz3LvK49b1.jpg,TMDb
Cars 2,Cars 2,"Jun 24, 2011",2011,2010s,"Adventure, Animation, Comedy",106.0,John Lasseter,"Larry the Cable Guy, Owen Wilson, Michael Caine, Emily Mortimer, Eddie Izzard",5,"La célèbre voiture de course Flash McQueen et l'incomparable dépanneuse Martin quittent Radiator Springs pour courir le tout premier Grand Prix mondial qui sacrera la voiture la plus rapide du monde. Mais la route est pleine d'imprévus, de déviations et de surprises, surtout lorsque Martin se retrouve entraîné dans une affaire d'espionnage international !",20000000000.0,High (>100M),55985239600.0,35985239600.0,1.8,True,62,Excellent (8+),https://media.themoviedb.org/t/p/w220_and_h330_face/okIz1HyxeVOMzYwwHUjH2pHi74I.jpg,TMDb
Now You See Me,Now You See Me,"May 31, 2013",2013,2010s,"Crime, Thriller",116.0,Edward Ricourt,"Jesse Eisenberg, Woody Harrelson, Isla Fisher, Dave Franco, Mark Ruffalo",5,"« Les Quatre Cavaliers », un groupe de brillants magiciens et illusionnistes, vient de donner deux spectacles de magie époustouflants: le premier en braquant une banque sur un autre continent, le deuxième en transférant la fortune d’un banquier véreux sur les comptes en banque du public. Deux agents spéciaux du FBI et d’Interpol sont déterminés à les arrêter avant qu’ils ne mettent à exécution leur promesse de réaliser des braquages encore plus audacieux. Ils font appel à Thaddeus, spécialiste reconnu pour expliquer les tours de magie les plus sophistiqués. Alors que la pression s’intensifie, et que le monde entier attend le spectaculaire tour final des Cavaliers, la course contre la montre commence.",7500000000.0,High (>100M),35172398900.0,27672398900.0,3.69,True,73,Excellent (8+),https://media.themoviedb.org/t/p/w220_and_h330_face/tWsNYbrqy1p1w6K9zRk0mSchztT.jpg,TMDb
Transformers: Rise of the Beasts,Transformers: Rise of the Beasts,"Jun 09, 2023",2023,2020s,"Action, Adventure",127.0,Joby Harold,"Anthony Ramos, Dominique Fishback, Peter Cullen, Ron Perlman, Peter Dinklage",5,"En 1994, alors que les Autobots viennent d'arriver, Optimus Prime s'acclimate à la Terre. Une archéologue et un ancien militaire vont découvrir les traces d'une guerre entre deux anciennes factions de Transformers, les Maximals et les Predacons. Optimus Prime devra faire face à de nouveaux ennemis, les Predacons et leur redoutable chef Scourge. Les Autobots et les Maximals feront face à une menace encore plus grande : Unicron, une planète métallique géante qui s'apprête à dévorer la Terre.",19500000000.0,High (>100M),44138119300.0,24638119300.0,1.26,True,72,Excellent (8+),https://media.themoviedb.org/t/p/w220_and_h330_face/gPbM0MK8CP8A174rmUwGsADNYKD.jpg,TMDb
