Movie_name,Original_Title,Release_date,Release_year,Release_decade,Genre,Runtime_minutes,Director,Top_Actors,Actor_count,Overview,Budget,Budget_category,Revenue,Profit,ROI,Is_profitable,Rating,Rating_category,Poster_URL,Source
Man of Steel,Man of Steel,"Jun 14, 2013",2013,2010s,"Action, Adventure",143.0,David S. Goyer,"Henry Cavill, Amy Adams, Russell Crowe, Michael Shannon, Kevin Costner",5,"Un petit garçon découvre qu’il possède des pouvoirs surnaturels et qu’il n’est pas né sur Terre. Plus tard, il s’engage dans un périple afin de comprendre d’où il vient et pourquoi il a été envoyé sur notre planète. Mais il devra devenir un héros s’il veut sauver le monde de la destruction totale et incarner l’espoir pour toute l’humanité.",22500000000.0,High (>100M),66804551800.0,44304551800.0,1.97,True,66,Excellent (8+),https://media.themoviedb.org/t/p/w220_and_h330_face/8GFtkImmK0K1VaUChR0n9O61CFU.jpg,TMDb
The Orgies Villa,The Orgies Villa,"Oct 17, 1964",1964,1960s,Comedy,84.0,Dinos Dimopoulos,"Labros Konstadaras, Kakia Analyti, Dionysis Papagiannopoulos, Andreas Douzos, Giannis Vogiatzis",5,"A parliamentary candidate and his mistress will spend the night at the police station. After all, no one is above the law, no matter what his credentials or social status may appear to be.",,Unknown,,,,,59,Excellent (8+),https://media.themoviedb.org/t/p/w220_and_h330_face/nUqgXIfNr2pGn4KOwIb1PbLEvfh.jpg,TMDb
The Bourne Identity,The Bourne Identity,"Jun 14, 2002",2002,2000s,"Action, Drama, Mystery, Thriller",118.0,Robert Ludlum,"Matt Damon, Franka Potente, Chris Cooper, Clive Owen, Brian Cox",5,"Un homme entre la vie et la mort est tiré de l’océan par un bateau de pêche italien. Ayant retrouvé ses esprits, il se rend compte qu’il souffre d’amnésie totale et qu’il n’a sur lui aucun papier d’identité. Les nombreux talents qu’il se découvre, techniques de combat et connaissances de plusieurs langues, lui suggèrent un passé dangereux. Aidé de la d’abord récalcitrante Marie, il s’engage dans une recherche désespérée pour retrouver son identité et la raison qui pousse d’impitoyables assassins à le traquer.",6000000000.0,High (>100M),21403422400.0,15403422400.0,2.57,True,75,Excellent (8+),https://media.themoviedb.org/t/p/w220_and_h330_face/aP8swke3gmowbkfZ6lmNidu0y9p.jpg,TMDb
Kung Fu Hustle,Kung Fu Hustle,"Apr 08, 2005",2005,2000s,"Action, Comedy, Crime, Fantasy",99.0,Stephen Chow,"Stephen Chow, Yuen Qiu, Yuen Wah, Lam Tze-Chung, Siu-Lung Leung",5,"Sing, un prétendu gangster, doit surmonter son incapacité à manier le sabre et démontrer qu’il a toutes les qualités requises pour appartenir au prestigieux gang de Axe. Dans le même temps, ce gang veut régner en maître sur le territoire le plus convoité qui est en fait une rue sacrée protégée par une bande de personnages hauts en couleurs. La plupart d’entre eux sont des maîtres du kung fu déguisés en personnes ordinaires. Après plusieurs rencontres avec des voyous et une véritable brute connu sous le nom de « The Beast », Sing parvient à vaincre ses handicaps et réalise qu’il est devenu l’un des plus grands maîtres de kung fu destiné à protéger la rue sacrée.",2000000000.0,High (>100M),10203410400.0,8203410400.0,4.1,True,75,Excellent (8+),https://media.themoviedb.org/t/p/w220_and_h330_face/exbyTbrvRUDKN2mcNEuVor4VFQW.jpg,TMDb
Kokuho,Kokuho,"Nov 14, 2025",2025,2020s,Drama,174.0,Sang-il Lee,"Ryo Yoshizawa, Ryusei Yokohama, Mitsuki Takahata, Shinobu Terajima, Soya Kurokawa",5,"Nagasaki, 1964 - A la mort de son père, chef d’un gang de yakuzas, Kikuo, 14 ans, est confié à un célèbre acteur de kabuki. Aux côtés de Shunsuke, le fils unique de ce dernier, il décide de se consacrer à ce théâtre traditionnel. Durant des décennies, les deux jeunes hommes évoluent côte à côte, de l’école du jeu aux plus belles salles de spectacle, entre scandales et gloire, fraternité et trahisons... L'un des deux deviendra le plus grand maître japonais de l'art du kabuki.",800000000.0,High (>100M),12310847100.0,11510847100.0,14.39,True,82,Excellent (8+),https://media.themoviedb.org/t/p/w220_and_h330_face/egDmNUBcSvu6aqQPCfyd1UneCYr.jpg,TMDb
Amélie,Amélie,"Nov 16, 2001",2001,2000s,"Comedy, Romance",120.0,Jean-Pierre Jeunet,"Audrey Tautou, Mathieu Kassovitz, Rufus, Serge Merlin, Jamel Debbouze",5,"Amélie, une jeune serveuse dans un bar de Montmartre, passe son temps à observer les gens et à laisser son imagination divaguer. Elle s'est fixée un but : faire le bien de ceux qui l'entourent. Elle invente alors des stratagèmes pour intervenir incognito dans leur existence. Le chemin d'Amélie est jalonné de rencontres: Georgette, la buraliste hypocondriaque, Lucien, le commis d'épicerie, Madeleine Wallace, la concierge portée sur le porto et les chiens empaillés, ou encore Raymond Dufayel alias « l'homme de verre », son voisin qui ne vit qu'à travers une reproduction d'un tableau de Renoir. Cette quête du bonheur amène Amélie à faire la connaissance de Nino Quincampoix, un étrange « prince charmant ». Celui-ci partage son temps entre un train fantôme et un sex-shop, et cherche à identifier un inconnu dont la photo réapparaît sans cesse dans plusieurs cabines de photomaton.",1000000000.0,High (>100M),17392195400.0,16392195400.0,16.39,True,79,Excellent (8+),https://media.themoviedb.org/t/p/w220_and_h330_face/nSxDa3M9aMvGVLoItzWTepQ5h5d.jpg,TMDb
Subservience,Subservience,"Sep 13, 2024",2024,2020s,"Horror, Thriller",105.0,SK Dale,"Megan Fox, Michele Morrone, Madeline Zima, Matilda Firth, Andrew Whipp",5,"Un père à bout de souffle se procure un robot humanoïde domestique pour l'aider à s'occuper de sa maison et de sa famille, ignorant qu’elle évoluera jusqu’à développer sa propre conscience et devenir mortelle.",440000000.0,High (>100M),26279300.0,-413720700.0,-0.94,False,66,Excellent (8+),https://media.themoviedb.org/t/p/w220_and_h330_face/gBenxR01Uy0Ev9RTIw6dVBPoyQU.jpg,TMDb
The Hobbit: The Desolation of Smaug,The Hobbit: The Desolation of Smaug,"Dec 13, 2013",2013,2010s,"Action, Adventure, Fantasy",161.0,Peter Jackson,"Ian McKellen, Martin Freeman, Richard Armitage, Benedict Cumberbatch, Orlando Bloom",5,"Bilbon Sacquet est entraîné dans une quête épique pour reconquérir le Royaume perdu des Nains d'Erebor et l'arracher aux griffes de l'effroyable dragon Smaug. Accompagné de 13 Nains et du Magicien Gandalf le Gris, Bilbon s'introduit dans la Montagne Solitaire armé du 'précieux' anneau de Gollum et de Dard, sa lame affûtée.",25000000000.0,High (>100M),95840000000.0,70840000000.0,2.83,True,76,Excellent (8+),https://media.themoviedb.org/t/p/w220_and_h330_face/xQYiXsheRCDBA39DOrmaw1aSpbk.jpg,TMDb
12 Angry Men,12 Angry Men,"Apr 10, 1957",1957,1950s,Drama,95.0,Reginald Rose,"Martin Balsam, John Fiedler, Lee J. Cobb, E.G. Marshall, Jack Klugman",5,"Un jeune homme d'origine modeste est accusé du meurtre de son père et risque la peine de mort. Le jury composé de douze hommes se retire pour délibérer et procède immédiatement à un vote : onze votent coupable, or la décision doit être prise à l'unanimité. Le juré qui a voté non-coupable, sommé de se justifier, explique qu'il a un doute et que la vie d'un homme mérite quelques heures de discussion. Il s'emploie alors à les convaincre un par un.",39775100.0,Medium (10-50M),436000000.0,396224900.0,9.96,True,86,Excellent (8+),https://media.themoviedb.org/t/p/w220_and_h330_face/ow3wq89wM8qd5X7hWKxiRfsFf9C.jpg,TMDb
Pillion,Pillion,"Feb 06, 2026",2026,2020s,"Comedy, Drama, Romance",103.0,Harry Lighton,"Harry Melling, Alexander Skarsgård, Lesley Sharp, Douglas Hodge, Jake Shears",5,"Colin, un jeune homme sans histoire, rencontre Ray, le leader charismatique d'un club de motards. Il l'introduit dans sa communauté queer et fait de Colin son soumis.",,Unknown,146031600.0,,,,61,Excellent (8+),https://media.themoviedb.org/t/p/w220_and_h330_face/7Pd6ChSQjSXy4snJiorSdzg2cG3.jpg,TMDb
2001: A Space Odyssey,2001: A Space Odyssey,"Apr 10, 1968",1968,1960s,"Adventure, Mystery",156.0,Stanley Kubrick,"Keir Dullea, Gary Lockwood, William Sylvester, Douglas Rain, Daniel Richter",5,"Aux temps préhistoriques, une petite tribu d’hommes‐singes installée au milieu de rochers arides lutte difficilement pour la vie. Un matin, ils trouvent devant eux une mystérieuse dalle noire monolithique. L’un des singes touche la pierre et apprend alors à se servir d’un os de quadrupède pour tuer ses ennemis. Quatre millions d’années plus tard, en 2001, un savant de l’espace, le Dr Heywood Floyd, débarque sur la lune pour examiner une dalle noire semblable à celle des singes, qui était enterrée sous la surface de l’astre. Selon les premières observations, l’objet émettrait un signal mystérieux…",1200000000.0,High (>100M),7192356000.0,5992356000.0,4.99,True,81,Excellent (8+),https://media.themoviedb.org/t/p/w220_and_h330_face/ve72VxNqjGM69Uky4WTo2bK6rfq.jpg,TMDb
I Saw the Devil,I Saw the Devil,"Mar 04, 2011",2011,2010s,"Horror, Thriller",142.0,Kim Jee-woon,"Lee Byung-hun, Choi Min-sik, Jeon Kuk-hwan, Cheon Ho-Jin, Oh San-ha",5,"Kyung-chul est un dangereux psychopathe qui tue pour le plaisir. Il commet des meurtres en série de manière que l’on ne peut même pas imaginer. Ses victimes sont aussi bien des femmes que des enfants. La police le traque depuis un long moment, mais est incapable de l’attraper. Un jour, Joo-yeon, la fille d’un chef de police à la retraite devient sa proie et est retrouvé morte atrocement mutilée. Son fiancé Dae-hoon, un agent secret, décide de traquer le meurtrier lui-même. Il promet de tout faire pour se venger, même si cela signifie qu’il doit devenir un monstre lui-même.",600000000.0,High (>100M),1296635700.0,696635700.0,1.16,True,78,Excellent (8+),https://media.themoviedb.org/t/p/w220_and_h330_face/zp5NrmYp80axIGiEiYPmm1CW6uH.jpg,TMDb
The Hangover Part III,The Hangover Part III,"May 23, 2013",2013,2010s,Comedy,100.0,Todd Phillips,"Bradley Cooper, Ed Helms, Zach Galifianakis, Justin Bartha, Ken Jeong",5,"Suite au décès du père d’Alan, la bande décide de le forcer à soigner ses problèmes mentaux. Mais comme d’habitude, rien ne se passe comme prévu. Une fois arrivés à l’hôpital, les hommes se font attaquer et Doug est kidnappé. La rançon ? Retrouver Mr. Chow en échange de la vie de Doug…",10300000000.0,High (>100M),36200007200.0,25900007200.0,2.51,True,62,Excellent (8+),https://media.themoviedb.org/t/p/w220_and_h330_face/vtxuPWkdllLNLVyGjKYa267ntuH.jpg,TMDb
Savage Flowers,Savage Flowers,"May 07, 2025",2025,2020s,"Horror, Thriller",98.0,Brad Watson,"Roxanne McKee, Olivia-Mai Barrett, Maddie Mills, Connie Jenkins-Greig, Meesha Garbett",5,Set in an infected world where the children are carriers - a young orphan finds sanctuary in a ramshackle foster home but she soon discovers it's not the world outside that she should fear. It's the girls she's inside with.,,Unknown,,,,,53,Excellent (8+),https://media.themoviedb.org/t/p/w220_and_h330_face/8MuzZokOBarqNltzGVW7AqQ0Swc.jpg,TMDb
Soul,Soul,"Jan 12, 2024",2024,2020s,"Animation, Comedy, Drama, Fantasy, Music",100.0,Pete Docter,"Jamie Foxx, Tina Fey, Graham Norton, Rachel House, Alice Braga",5,"Passionné de jazz et professeur de musique dans un collège, Joe Gardner a enfin l’opportunité de réaliser son rêve : jouer dans le meilleur club de jazz de New York. Mais un malencontreux faux pas le précipite dans le « Grand Avant » – un endroit fantastique où les nouvelles âmes acquièrent leur personnalité, leur caractère et leur spécificité avant d’être envoyées sur Terre. Bien décidé à retrouver sa vie, Joe fait équipe avec 22, une âme espiègle et pleine d’esprit, qui n’a jamais saisi l’intérêt de vivre une vie humaine. En essayant désespérément de montrer à 22 à quel point l’existence est formidable, Joe pourrait bien découvrir les réponses aux questions les plus importantes sur le sens de la vie.",15000000000.0,High (>100M),12197751100.0,-2802248900.0,-0.19,False,81,Excellent (8+),https://media.themoviedb.org/t/p/w220_and_h330_face/6jmppcaubzLF8wkXM36ganVISCo.jpg,TMDb
Aladdin,Aladdin,"Nov 25, 1992",1992,1990s,"Adventure, Animation, Fantasy, Romance",90.0,Ron Clements,"Scott Weinger, Robin Williams, Linda Larkin, Jonathan Freeman, Gilbert Gottfried",5,"Aladdin, un jeune orphelin chapardeur, fait équipe avec Jasmine, une princesse astucieuse et sure d’elle, pour empêcher le sorcier maléfique Jafar de s’emparer du royaume. En chemin, il prend confiance en lui grâce à un génie métamorphe facétieux, dont les trois souhaits peuvent tout changer.",2800000000.0,High (>100M),50405021900.0,47605021900.0,17.0,True,77,Excellent (8+),https://media.themoviedb.org/t/p/w220_and_h330_face/eLFfl7vS8dkeG1hKp5mwbm37V83.jpg,TMDb
A Nice Indian Boy,A Nice Indian Boy,"Apr 04, 2025",2025,2020s,"Comedy, Romance",96.0,Roshan Sethi,"Karan Soni, Jonathan Groff, Sunita Mani, Zarna Garg, Harish Patel",5,"Après s'être fiancé à un photographe blanc élevé par des parents indiens, un médecin américain d'origine indienne tente de le présenter à sa famille traditionnelle.",,Unknown,,,,,73,Excellent (8+),https://media.themoviedb.org/t/p/w220_and_h330_face/xfY2FZlnm5uaQbaWR9IYW41J1xG.jpg,TMDb
Top Gun,Top Gun,"May 16, 1986",1986,1980s,"Action, Drama",109.0,Tony Scott,"Tom Cruise, Kelly McGillis, Val Kilmer, Anthony Edwards, Tom Skerritt",5,"Jeune as du pilotage et tête brûlée d'une école réservée à l'élite de l'Aéronavale américaine, la fameuse « Top Gun », Pete Mitchell, dit Maverick, tombe sous le charme d'une instructrice alors qu'il est en compétition pour le titre du meilleur pilote…",1500000000.0,High (>100M),35683060100.0,34183060100.0,22.79,True,71,Excellent (8+),https://media.themoviedb.org/t/p/w220_and_h330_face/xUuHj3CgmZQ9P2cMaqQs4J0d4Zc.jpg,TMDb
The Little Mermaid,The Little Mermaid,"Nov 17, 1989",1989,1980s,"Animation, Fantasy",83.0,Ron Clements,"Jodi Benson, Samuel E. Wright, Pat Carroll, Christopher Daniel Barnes, Kenneth Mars",5,"Ariel, une sirène fascinée par l'univers des humains, défie l'interdiction de son père de rester sous la surface. Lors d'une tempête, elle sauve le prince de ses rêves. Elle conclut un pacte avec la sorcière des mers : des jambes en échange de sa queue de sirène et de sa jolie voix. Ariel entame une course contre la montre pour conquérir le cœur de son prince et sauver le royaume de son père.",4000000000.0,High (>100M),21134347900.0,17134347900.0,4.28,True,74,Excellent (8+),https://media.themoviedb.org/t/p/w220_and_h330_face/plcZXvI310FkbwIptvd6rqk63LP.jpg,TMDb
The Black Phone,The Black Phone,"Jun 24, 2022",2022,2020s,"Horror, Thriller",103.0,Scott Derrickson,"Mason Thames, Madeleine McGraw, Ethan Hawke, Jeremy Davies, E. Roger Mitchell",5,"Finney Shaw, un adolescent de 13 ans, timide mais intelligent, est enlevé par un tueur sadique qui l’enferme dans un sous-sol insonorisé où s’époumoner n’est pas d’une grande utilité. Quand un téléphone accroché au mur, pourtant hors d’usage, se met à sonner, Finney va découvrir qu’il est en contact avec les voix des précédentes victimes de son ravisseur. Ils sont aussi morts que bien résolus à ce que leur triste sort ne devienne pas celui de Finney.",1600000000.0,High (>100M),16144191400.0,14544191400.0,9.09,True,75,Excellent (8+),https://media.themoviedb.org/t/p/w220_and_h330_face/p9ZUzCyy9wRTDuuQexkQ78R2BgF.jpg,TMDb
Turning Red,Turning Red,"Feb 09, 2024",2024,2020s,"Animation, Comedy, Fantasy",100.0,Domee Shi,"Rosalie Chiang, Sandra Oh, Ava Morse, Hyein Park, Maitreyi Ramakrishnan",5,"Les aventures de Meilin Lee, une jeune adolescente de 13 ans, pleine d’assurance, mais tiraillée entre son image de petite fille modèle aux yeux de sa mère hyper protectrice et le chaos de l’adolescence. Et comme si tous les changements qui s’opèrent en elle ne suffisaient pas, chaque fois qu’elle est débordée par ses émotions - ce qui, pour une ado, arrive quasiment tout le temps - elle se transforme en panda roux géant !",,Unknown,2181335800.0,,,,73,Excellent (8+),https://media.themoviedb.org/t/p/w220_and_h330_face/qsdjk9oAKSQMWs0Vt5Pyfh6O4GZ.jpg,TMDb
The Amazing Spider-Man 2,The Amazing Spider-Man 2,"May 02, 2014",2014,2010s,"Action, Adventure",142.0,Alex Kurtzman,"Andrew Garfield, Emma Stone, Jamie Foxx, Dane DeHaan, Colm Feore",5,"Peter Parker a une vie très occupée partagée entre son combat contre les vilains et la personne qu’il aime, Gwen. Il attend donc son diplôme de fin de lycée avec impatience. Peter n’a pas oublié la promesse qu’il a faite au père de Gwen : la protéger en restant hors de son existence. Une promesse qu’il ne peut pas tenir. Les choses vont changer pour Peter quand un nouveau vilain fait son apparition, Electro, quand un vieil ami fait son retour, Harry Osborn, et quand Peter découvre de nouveaux indices sur son passé.",20000000000.0,High (>100M),70896232300.0,50896232300.0,2.54,True,65,Excellent (8+),https://media.themoviedb.org/t/p/w220_and_h330_face/dGjoPttcbKR5VWg1jQuNFB247KL.jpg,TMDb
Her,Her,"Dec 18, 2013",2013,2010s,"Drama, Romance",126.0,Spike Jonze,"Joaquin Phoenix, Scarlett Johansson, Lynn Adrianna, Lisa Renee Pitts, Gabe Gomez",5,"Los Angeles, dans un futur proche. Theodore Twombly, un homme sensible au caractère complexe, est inconsolable suite à une rupture difficile. Il fait alors l'acquisition d'un programme informatique ultramoderne, capable de s'adapter à la personnalité de chaque utilisateur. En lançant le système, il fait la connaissance de 'Samantha', une voix féminine intelligente, intuitive et étonnamment drôle. Les besoins et les désirs de Samantha grandissent et évoluent, tout comme ceux de Theodore, et peu à peu, ils tombent amoureux…",2300000000.0,High (>100M),4735125100.0,2435125100.0,1.06,True,78,Excellent (8+),https://media.themoviedb.org/t/p/w220_and_h330_face/eCOtqtfvn7mxGl6nfmq4b1exJRc.jpg,TMDb
Colombiana,Colombiana,"Aug 26, 2011",2011,2010s,"Action, Crime, Drama, Thriller",105.0,Olivier Megaton,"Zoe Saldaña, Cliff Curtis, Callum Blue, Michael Vartan, Lennie James",5,"1992, Colombie. Cataleya, 9 ans, assiste au meurtre de ses parents. Échappant de justesse au massacre, elle se réfugie aux États-Unis, chez son oncle Emilio, un gangster... 15 ans plus tard, elle travaille pour lui comme tueuse à gages. Elle signe ses meurtres d'une orchidée dessinée sur le torse de ses victimes: un message à l'intention des assassins de ses parents. Car Cataleya est bien décidée à aller jusqu'au bout de sa vengeance... quitte à perdre tous ceux qu'elle aime.",4000000000.0,High (>100M),7150844000.0,3150844000.0,0.79,True,66,Excellent (8+),https://media.themoviedb.org/t/p/w220_and_h330_face/rEdGDgRB3gducezNSIyx2lbKQy4.jpg,TMDb
Star Wars: Episode III - Revenge of the Sith,Star Wars: Episode III - Revenge of the Sith,"May 19, 2005",2005,2000s,"Action, Adventure",140.0,George Lucas,"Hayden Christensen, Ewan McGregor, Natalie Portman, Ian McDiarmid, Samuel L. Jackson",5,"La Guerre des Clones fait rage. Une franche hostilité oppose désormais le Chancelier Palpatine au Conseil Jedi. Anakin Skywalker, jeune Chevalier Jedi pris entre deux feux, hésite sur la conduite à tenir. Séduit par la promesse d'un pouvoir sans précédent, tenté par le côté obscur de la Force, il prête allégeance au maléfique Darth Sidious et devient Dark Vador. Les Seigneurs Sith s'unissent alors pour préparer leur revanche, qui commence par l'extermination des Jedi. Seuls rescapés du massacre, Yoda et Obi-Wan se lancent à la poursuite des Sith. La traque se conclut par un spectaculaire combat au sabre entre Anakin et Obi-Wan, qui décidera du sort de la galaxie…",11300000000.0,High (>100M),85000000000.0,73700000000.0,6.52,True,75,Excellent (8+),https://media.themoviedb.org/t/p/w220_and_h330_face/xfSAoBEm9MNBjmlNcDYLvLSMlnq.jpg,TMDb
The Amateur,The Amateur,"Apr 11, 2025",2025,2020s,"Action, Thriller",123.0,James Hawes,"Rami Malek, Holt McCallany, Danny Sapani, Rachel Brosnahan, Michael Stuhlbarg",5,"Charlie Heller est un cryptographe génial mais introverti. Il travaille pour la CIA, dans le sous-sol de son quartier général à Langley. Sa vie est bouleversée quand sa femme est tuée lors d'une attaque terroriste à Londres. Ses superviseurs refusent d'agir. Il décide donc de prendre les choses en main et parcourt le monde à la recherche des responsables de l'attentat. Son intelligence est son arme ultime, elle lui permet d'échapper à ses poursuivants et d'accomplir sa vengeance.",6000000000.0,High (>100M),9600083600.0,3600083600.0,0.6,True,70,Excellent (8+),https://media.themoviedb.org/t/p/w220_and_h330_face/SNEoUInCa5fAgwuEBMIMBGvkkh.jpg,TMDb
"Red, White & Royal Blue","Red, White & Royal Blue","Aug 10, 2023",2023,2020s,"Comedy, Romance",118.0,Matthew López,"Taylor Zakhar Perez, Nicholas Galitzine, Uma Thurman, Clifton Collins Jr., Rachel Hilson",5,"Le fils de la présidente américaine, Alex Claremont-Diaz, est un beau parti. Cependant, il a une altercation avec son homologue royal britannique, le prince Henry, prise en photo par des paparazzis. Cette querelle remet en cause les relations diplomatiques anglo-américaines. Les deux familles organisent alors un rapprochement amical entre les deux jeunes hommes.",,Unknown,,,,,79,Excellent (8+),https://media.themoviedb.org/t/p/w220_and_h330_face/ta3ReqbdEcLJM3mcHMzbYFZI8v7.jpg,TMDb
Light of the World,Light of the World,"Sep 05, 2025",2025,2020s,"Animation, Drama, Fantasy, Music",84.0,Tom Bancroft,"Ian Hanlin, Benjamin Jacobson, Vincent Tong, Michael Benyaer, David Kaye",5,"It's 30 AD and everyone is expectantly awaiting the coming Messiah. While Jesus isn't exactly what they imagined, there is something special about this man. Soon, John, James, Andrew, Peter, and others begin to follow Jesus on an unexpected adventure. This beautifully animated story of Jesus is told through the eyes of his beloved young friend, the Apostle John.",2000000000.0,High (>100M),259570200.0,-1740429800.0,-0.87,False,84,Excellent (8+),https://media.themoviedb.org/t/p/w220_and_h330_face/3vUqo90FCIHXPiXnQJEeqzg5EDV.jpg,TMDb
Mean Girls,Mean Girls,"Apr 30, 2004",2004,2000s,"Comedy, Drama",98.0,Mark Waters,"Lindsay Lohan, Rachel McAdams, Lizzy Caplan, Lacey Chabert, Amanda Seyfried",5,"Cady débarque d'Afrique et atterrit dans un lycée de l'Illinois, véritable élevage de lolitas branchées. Au sommet de la hiérarchie, Régina, barbie-manipulatrice qui voit en elle une rivale potentielle et décide de se la jouer copine. Mais quand Cady commet l'erreur de sortir avec l'ex de Régina, une guerre impitoyable est déclarée.",1700000000.0,High (>100M),13019351400.0,11319351400.0,6.66,True,72,Excellent (8+),https://media.themoviedb.org/t/p/w220_and_h330_face/2ZkuQXvVhh45uSvkBej4S7Ix1NJ.jpg,TMDb
Dances with Wolves,Dances with Wolves,"Nov 09, 1990",1990,1990s,"Adventure, Drama, Western",233.0,Kevin Costner,"Kevin Costner, Mary McDonnell, Graham Greene, Rodney A. Grant, Floyd ""Red Crow"" Westerman",5,"Durant la guerre de Sécession, le lieutenant John Dunbar, envoyé à un poste de reconnaissance dans les plaines du Dakota, rencontre le peuple sioux. Il se lie d'amitié avec la population indienne, au point d'intégrer une tribu et de s'éprendre de l'une des leurs.",2200000000.0,High (>100M),42420884800.0,40220884800.0,18.28,True,78,Excellent (8+),https://media.themoviedb.org/t/p/w220_and_h330_face/hw0ZEHAaTqTxSXGVwUFX7uvanSA.jpg,TMDb
Cold Storage,Cold Storage,"Feb 13, 2026",2026,2020s,"Comedy, Thriller",99.0,David Koepp,"Georgina Campbell, Joe Keery, Liam Neeson, Sosie Bacon, Vanessa Redgrave",5,"Un agent du Pentagone, Roberto Diaz, enquête sur une attaque biochimique présumée. Sur place, il découvre quelque chose de bien pire : un organisme hautement mutant et destructeur. Après l'avoir enfermé dans un entrepôt frigorifique au fond d'un dépôt militaire rarement utilisé pendant des décennies, le spécimen finit par s'échapper.",,Unknown,,,,,0,Below Average (<5),https://media.themoviedb.org/t/p/w220_and_h330_face/pfqkETJ2A3zXZJuNcufZbAJNnKA.jpg,TMDb
Eyes Wide Shut,Eyes Wide Shut,"Jul 16, 1999",1999,1990s,"Drama, Mystery, Thriller",159.0,Stanley Kubrick,"Tom Cruise, Nicole Kidman, Sydney Pollack, Marie Richardson, Rade Šerbedžija",5,"Conviés à une soirée donnée par leur ami Victor Ziegler, le docteur William « Bill » Harford et son épouse Alice font, chacun de son côté, l'objet de tentatives de séduction plutôt osées. L'un et l'autre résistent à la tentation. Cependant, le lendemain, Alice avoue à son mari qu'elle a naguère songé à le tromper et regrette aujourd'hui de ne pas être passée à l'acte. Très ébranlé par cette révélation, William se rend chez une patiente, une jeune femme vulnérable qui vient de perdre son père. Celle-ci, contre toute attente, lui déclare sa flamme. De plus en plus perturbé, il choisit de s'enfuir. Dans la rue, il se fait accoster par une jeune prostituée, Domino, qui l'entraîne chez elle…",6500000000.0,High (>100M),16210000000.0,9710000000.0,1.49,True,75,Excellent (8+),https://media.themoviedb.org/t/p/w220_and_h330_face/knEIz1eNGl5MQDbrEAVWA7iRqF9.jpg,TMDb
Tom and Jerry: Forbidden Compass,Tom and Jerry: Forbidden Compass,"Aug 02, 2025",2025,2020s,"Animation, Comedy",104.0,Zhang Gang,"Jiang Wen, Shun Zi, Tu Xiongfei",3,"The iconic cat-and-mouse duo accidentally travel through time in a museum. Along their journey, they meet a group of intriguing new companions and become involved in a final showdown with mysterious forces.",,Unknown,75138500.0,,,,43,Excellent (8+),https://media.themoviedb.org/t/p/w220_and_h330_face/5qttWFjsO62k88civZaDMHiBTvy.jpg,TMDb
