Movie_name,Original_Title,Release_date,Release_year,Release_decade,Genre,Runtime_minutes,Director,Top_Actors,Actor_count,Overview,Budget,Budget_category,Revenue,Profit,ROI,Is_profitable,Rating,Rating_category,Poster_URL,Source
Bad Boys: Ride or Die,Bad Boys: Ride or Die,"Jun 07, 2024",2024,2020s,"Action, Adventure, Comedy, Crime, Thriller",115.0,George Gallo,"Will Smith, Martin Lawrence, Vanessa Hudgens, Alexander Ludwig, Paola Nuñez",5,"Le détective de Miami Mike Lowrey apprend que son ex-supérieur à l'escouade anti-drogue, le défunt capitaine Howard, aurait reçu des centaines de millions de dollars de la part des cartels mexicains. Avec son coéquipier et ami Marcus Burnett, Mike entreprend de blanchir la réputation de Howard. Or, le meurtrier du capitaine, le trafiquant Armando Aretas, est le seul à pouvoir identifier le véritable traître au sein des forces de police de Miami. Et puisque le repenti Armando est également le fils de Mike, ce dernier obtient qu'il soit temporairement libéré de prison pour participer à l'enquête. Mais ce faisant, Marcus, Mike et son fils se retrouvent à leur tour compromis par le chef des conspirateurs, qui lance des chasseurs de primes à leurs trousses.",10000000000.0,High (>100M),40454781900.0,30454781900.0,3.05,True,73,Excellent (8+),https://media.themoviedb.org/t/p/w220_and_h330_face/oGythE98MYleE6mZlGs5oBGkux1.jpg,TMDb
Guardians of the Galaxy Vol. 2,Guardians of the Galaxy Vol. 2,"May 05, 2017",2017,2010s,"Action, Adventure",138.0,James Gunn,"Chris Pratt, Zoe Saldaña, Dave Bautista, Vin Diesel, Bradley Cooper",5,"Avec en toile de fond l’Awesome Mixtape #2, Les Gardiens de la Galaxie Vol. 2 poursuit les aventures de l’équipe alors qu’ils traversent les confins du cosmos. Les Gardiens doivent se battre pour que leur nouvelle famille reste ensemble tandis qu’ils cherchent à percer le mystère de la véritable filiation de Star-Lord. De vieux ennemis deviennent de nouveaux alliés et des personnages appréciés des fans, issus des comics, viennent en aide à nos héros alors que l’Univers Cinématographique Marvel continue de se développer.",20000000000.0,High (>100M),86375605100.0,66375605100.0,3.32,True,76,Excellent (8+),https://media.themoviedb.org/t/p/w220_and_h330_face/y4MBh0EjBlMuOzv9axM4qJlmhzz.jpg,TMDb
Shutter Island,Shutter Island,"Feb 19, 2010",2010,2010s,"Drama, Mystery, Thriller",138.0,Martin Scorsese,"Leonardo DiCaprio, Mark Ruffalo, Ben Kingsley, Max von Sydow, Michelle Williams",5,"En 1954, le marshal Teddy Daniels et son coéquipier Chuck Aule sont envoyés enquêter sur l’île de Shutter Island, dans un hôpital psychiatrique où sont internés de dangereux criminels. L’une des patientes, Rachel Solando, a inexplicablement disparu. Comment la meurtrière a‐t‐elle pu sortir d’une cellule fermée de l’extérieur ? Le seul indice retrouvé dans la pièce est une feuille de papier sur laquelle on peut lire une suite de chiffres et de lettres sans signification apparente. Œuvre cohérente d’une malade, ou cryptogramme ?",8000000000.0,High (>100M),29480419500.0,21480419500.0,2.69,True,82,Excellent (8+),https://media.themoviedb.org/t/p/w220_and_h330_face/nrmXQ0zcZUL8jFLrakWc90IR8z9.jpg,TMDb
Mufasa: The Lion King,Mufasa: The Lion King,"Dec 20, 2024",2024,2020s,"Adventure, Animation",118.0,Barry Jenkins,"Aaron Pierre, Kelvin Harrison, Jr., Tiffany Boone, Kagiso Lediga, Preston Nyman",6,"Suivez l'épopée de l'improbable ascension du roi bien-aimé de la Terre des Lions. Mufasa est un orphelin seul et perdu jusqu'à ce qu'il rencontre Taka, héritier de sang royal. C'est le début d'un voyage épique au cours duquel ils tenteront d'échapper à un ennemi redoutable, ce qui mettra leurs liens à rude épreuve.",20000000000.0,High (>100M),72263175600.0,52263175600.0,2.61,True,73,Excellent (8+),https://media.themoviedb.org/t/p/w220_and_h330_face/lurEK87kukWNaHd0zYnsi3yzJrs.jpg,TMDb
Puss in Boots: The Last Wish,Puss in Boots: The Last Wish,"Dec 21, 2022",2022,2020s,"Adventure, Animation, Comedy, Fantasy",102.0,Tommy Swerdlow,"Antonio Banderas, Salma Hayek Pinault, Harvey Guillén, Wagner Moura, Florence Pugh",5,"Le Chat Potté découvre que sa passion pour l'aventure et son mépris du danger ont fini par lui coûter cher : il a épuisé huit de ses neuf vies, et en a perdu le compte au passage. Afin de retomber sur ses pattes notre héros velu se lance littéralement dans la quête de sa vie. Il s'embarque dans une aventure épique aux confins de la Forêt Sombre afin de dénicher la mythique Étoile à vœu, seule susceptible de lui rendre ses vies perdues. Mais quand il ne vous en reste qu’une, il faut savoir faire profil bas, se montrer prudent et demander de l’aide. C’est ainsi qu’il se tourne vers son ancienne partenaire et meilleure ennemie de toujours : l’ensorcelante Kitty Pattes De Velours. Le Chat Potté et la belle Kitty vont être aidés dans leur quête, à leur corps bien défendant, par Perro, un corniaud errant et galeux à la langue bien pendue et d’une inaltérable bonne humeur.",9000000000.0,High (>100M),48470000000.0,39470000000.0,4.39,True,82,Excellent (8+),https://media.themoviedb.org/t/p/w220_and_h330_face/kuf6dutpsT0vSVehic3EZIqkOBt.jpg,TMDb
Kingdom of Heaven,Kingdom of Heaven,"May 06, 2005",2005,2000s,"Action, Adventure, Drama, War",144.0,Ridley Scott,"Orlando Bloom, Eva Green, Jeremy Irons, David Thewlis, Ghassan Massoud",5,"Balian le forgeron découvre que son père est un seigneur Croisé, peu avant que celui-ci ne meure et que ses terres à Jérusalem ne lui reviennent. Parti sur place, il se range au côté des fidèles du roi Baudoin, qui tentent de maintenir un équilibre fragile entre les Croisés et les troupes de Saladin. Mais le roi est mourant et puissants sont ceux qui s'opposent à lui et à la paix.",13000000000.0,High (>100M),21836633600.0,8836633600.0,0.68,True,70,Excellent (8+),https://media.themoviedb.org/t/p/w220_and_h330_face/rNaBe4TwbMef71sgscqabpGKsxh.jpg,TMDb
Beauty from Pain,Beauty from Pain,"Dec 18, 2025",2025,2020s,"Drama, Romance",116.0,Christine Luby,"Samantha Allsop, Jackson Gallagher, Callan Colley, Brittany Grey",4,"After a devastating heartbreak, an aspiring musician escapes to Australia. She agrees to a no-strings romance with a billionaire winemaker, but when she falls in love she must choose to walk away or risk her heart on a man afraid to love.",,Unknown,,,,,76,Excellent (8+),https://media.themoviedb.org/t/p/w220_and_h330_face/mJtBKvHQaFzgp0N6JFskSvjbTar.jpg,TMDb
We Can Be Heroes,We Can Be Heroes,"Dec 25, 2020",2020,2020s,"Action, Comedy, Fantasy",100.0,Robert Rodriguez,"YaYa Gosselin, Lyon Daniels, Andy Walken, Hala Finley, Lotus Blossom",5,"Lorsque des envahisseurs venus de l'espace enlèvent les super-héros de la Terre, les enfants unissent leurs forces pour sauver leurs parents et le monde.",,Unknown,,,,,60,Excellent (8+),https://media.themoviedb.org/t/p/w220_and_h330_face/1S21HpcKY6uQ9UAw68aICmrJaq6.jpg,TMDb
Batman Begins,Batman Begins,"Jun 15, 2005",2005,2000s,"Action, Crime, Drama",140.0,Christopher Nolan,"Christian Bale, Michael Caine, Liam Neeson, Katie Holmes, Gary Oldman",5,"Alors que le souvenir de ses parents assassinés le hante, Bruce Wayne, désemparé, erre à travers le monde cherchant les moyens de combattre l'injustice et ses propres peurs. Avec l'aide de son dévoué majordome et homme de confiance Alfred, de l'inspecteur Jim Gordon et de son allié Lucius Fox, Wayne revient à Gotham City et révèle son alter ego : Batman, un justicier masqué qui utilise sa force, son intelligence et une batterie d'armes high-tech pour combattre les forces sinistres qui menacent la ville…",15000000000.0,High (>100M),37421867300.0,22421867300.0,1.49,True,77,Excellent (8+),https://media.themoviedb.org/t/p/w220_and_h330_face/sPX89Td70IDDjVr85jdSBb4rWGr.jpg,TMDb
The Lion King,The Lion King,"Jun 15, 1994",1994,1990s,"Adventure, Animation, Drama",88.0,Roger Allers,"Matthew Broderick, Moira Kelly, Nathan Lane, Ernie Sabella, James Earl Jones",5,"Disney présente l'histoire de Simba, un fougueux lionceau qui « voudrait déjà être roi ». Éloigné par son sombre et ambitieux oncle Scar, Simba profite de la vie avec ses drôles de compagnons Timon et Pumbaa, oubliant son rang et ses responsabilités. Mais son destin l'appelle à rentrer auprès des siens et à reprendre sa place dans le Grand Cercle de la Vie.",4500000000.0,High (>100M),76345556100.0,71845556100.0,15.97,True,83,Excellent (8+),https://media.themoviedb.org/t/p/w220_and_h330_face/sKCr78MXSLixwmZ8DyJLrpMsd15.jpg,TMDb
The Handmaiden,The Handmaiden,"Oct 21, 2016",2016,2010s,"Drama, Romance, Thriller",145.0,Park Chan-Wook,"Kim Min-hee, Kim Tae-ri, Ha Jeong-Woo, Cho Jin-woong, Kim Hae-sook",5,"Corée. Années 30, pendant la colonisation japonaise. Une jeune femme est engagée comme servante d’une riche japonaise, vivant recluse dans un immense manoir sous la coupe d’un oncle tyrannique. Mais Sookee a un secret. Avec l’aide d’un escroc se faisant passer pour un comte japonais, ils ont d’autres plans pour Hideko…",857500000.0,High (>100M),3860000000.0,3002500000.0,3.5,True,82,Excellent (8+),https://media.themoviedb.org/t/p/w220_and_h330_face/dLlH4aNHdnmf62umnInL8xPlPzw.jpg,TMDb
Io sono Tempesta,Io sono Tempesta,"Apr 12, 2018",2018,2010s,Comedy,97.0,Daniele Luchetti,"Marco Giallini, Elio Germano, Eleonora Danco, Jo Sung, Francesco Gheghi",5,"To avoid jail, a tax-dodging businessman is sentenced to a year of community service in a homeless shelter.",,Unknown,,,,,58,Excellent (8+),https://media.themoviedb.org/t/p/w220_and_h330_face/qlYY3pk7JJ3iDkXzyCU4OvgFhCV.jpg,TMDb
Karate Kid: Legends,Karate Kid: Legends,"May 30, 2025",2025,2020s,"Action, Adventure, Drama",94.0,Robert Mark Kamen,"Jackie Chan, Ben Wang, Joshua Jackson, Sadie Stanley, Ming-Na Wen",5,"Li Fong, un adolescent qui fréquente l'école de kung-fu de M. Han en Chine, doit déménager à New York avec sa mère. Celle-ci souhaite que son fils intègre une école prestigieuse et qu'il mette de côté son sport de combat. À son arrivée dans sa nouvelle ville, Li rencontre Mia, une camarade de classe, ainsi que le père de celle-ci avec lesquels il se lie d'amitié. Li se retrouve ensuite entraîné dans une compétition d'arts martiaux où il doit affronter un redoutable champion de karaté.",4500000000.0,High (>100M),11710546600.0,7210546600.0,1.6,True,71,Excellent (8+),https://media.themoviedb.org/t/p/w220_and_h330_face/c90Lt7OQGsOmhv6x4JoFdoHzw5l.jpg,TMDb
King Kong,King Kong,"Dec 14, 2005",2005,2000s,"Action, Adventure, Drama",188.0,Peter Jackson,"Naomi Watts, Adrien Brody, Jack Black, Andy Serkis, Colin Hanks",5,"Carl Denham, un cinéaste en quête de notoriété, prépare un tournage dans les mers du Sud. Il embarque avec toute son équipe à bord du «Venture». Bien que les acteurs soient persuadés de tourner un film d'amour et d'aventures, le réalisateur espère secrètement que le voyage les conduira à Skull Island (l'île du Crâne), une terre inexplorée où, dit-on, les indigènes adorent une créature mystérieuse et terrifiante. Les foules, pense-t-il, se presseront pour découvrir les images qu'il rapportera de son voyage. Ann Darrow, artiste de music-hall au chômage, a été embauchée au dernier moment pour pallier la défection de l'actrice principale.",20700000000.0,High (>100M),56236344900.0,35536344900.0,1.72,True,69,Excellent (8+),https://media.themoviedb.org/t/p/w220_and_h330_face/6a2HY6UmD7XiDD3NokgaBAXEsD2.jpg,TMDb
Ligaw,Ligaw,"May 09, 2025",2025,2020s,"Drama, Romance",85.0,Omar Deroca,"Robb Guinto, Ali Asistio, JC Tan, Rash Flores, Jodi Garcia",5,"Une femme sensuelle qui charme le cœur des hommes dans une province reculée. Dolores, épouse dévouée de son mari paraplégique, tombe amoureuse d'un jeune alpiniste. Ce qui commence comme une évasion téméraire se transforme en une liaison empreinte de passion et de secret.",,Unknown,,,,,60,Excellent (8+),https://media.themoviedb.org/t/p/w220_and_h330_face/yc8V3KEnhvPrzXpdYTXdTvjpOb5.jpg,TMDb
David,David,"Dec 14, 2025",2025,2020s,"Animation, Drama",109.0,Brent Dawes,"Phil Wickham, Brandon Engman, Asim Chaudhry, Mick Wingert, Mark Whitten",5,"Des chants du cœur de sa mère aux murmures d'un Dieu fidèle, l'histoire de David commence dans une dévotion silencieuse. Lorsque le géant Goliath se lève pour terroriser une nation, un jeune berger armé uniquement d'une fronde, de quelques pierres et d'une foi inébranlable s'avance. Poursuivi par le pouvoir et animé par un but précis, son parcours met à l'épreuve les limites de la loyauté, de l'amour et du courage, et culmine dans une bataille qui ne vise pas seulement la couronne, mais aussi l'âme d'un royaume.",6090000000.0,High (>100M),7777027500.0,1687027500.0,0.28,True,77,Excellent (8+),https://media.themoviedb.org/t/p/w220_and_h330_face/7lFG1WrCwAxBfyGK8ahlBVzXno7.jpg,TMDb
Heads of State,Heads of State,"Jun 24, 2025",2025,2020s,"Action, Comedy, Thriller",116.0,Harrison Query,"John Cena, Idris Elba, Priyanka Chopra Jonas, Paddy Considine, Carla Gugino",5,"Le Premier ministre britannique et le président des États-Unis ont une rivalité publique qui menace l'alliance entre leurs pays. Mais lorsqu'ils deviennent les cibles d'un ennemi puissant, ils sont contraints de compter l'un sur l'autre et se lancent dans une folle course multinationale. Alliés à Noel, une brillante agente du MI6, ils doivent trouver un moyen de déjouer une conspiration qui menace le monde libre.",10000.0,Low (<1M),,,,,68,Excellent (8+),https://media.themoviedb.org/t/p/w220_and_h330_face/lVgE5oLzf7ABmzyASEVcjYyHI41.jpg,TMDb
Art of Eight Limbs,Art of Eight Limbs,"Aug 16, 2024",2024,2020s,"Action, Thriller",101.0,Robert Grasmere,"Ludi Lin, Grace Vorananth, Sahajak Boonthanakit, Nicholas Hammond, Vithaya Pansringarm",5,"En mission au Myanmar, un analyste de données de la CIA et un kickboxer à temps partiel doivent infiltrer un tournoi d’arts martiaux qui sert de couverture à un marchand d’armes vendant du gaz neurotoxique VX. Son objectif: fournir un dispositif de détection crucial, aux alliés. Cependant, alors que la mission devient incontrôlable, il est forcé de faire face aux combattants les plus impitoyables du monde, étant considéré comme la dernière ligne de défense contre une menace mondiale imminente.",10100.0,Low (<1M),,,,,64,Excellent (8+),https://media.themoviedb.org/t/p/w220_and_h330_face/tZRypLd2SU3Eeqg5tD5cwkk5CdL.jpg,TMDb
Babylon,Babylon,"Dec 23, 2022",2022,2020s,"Comedy, Drama",189.0,Damien Chazelle,"Diego Calva, Margot Robbie, Brad Pitt, Jovan Adepo, Jean Smart",5,"Los Angeles des années 1920. Récit d’une ambition démesurée et d’excès les plus fous, le film retrace l’ascension et la chute de différents personnages lors de la création d’Hollywood, une ère de décadence et de dépravation sans limites.",7800000000.0,High (>100M),6526744600.0,-1273255400.0,-0.16,False,74,Excellent (8+),https://media.themoviedb.org/t/p/w220_and_h330_face/wjOHjWCUE0YzDiEzKv8AfqHj3ir.jpg,TMDb
She Rides Shotgun,She Rides Shotgun,"Aug 01, 2025",2025,2020s,"Action, Crime, Thriller",120.0,Nick Rowland,"Taron Egerton, Ana Sophia Heger, Odessa A'zion, John Carroll Lynch, David Lyons",5,"Après des années de prison, Nate s'est fait de dangereux ennemis, dont le puissant gang criminel pour lequel il travaillait en prison. Pour prendre un nouveau départ, Nate rompt tout lien avec son ancien gang dès sa sortie, mais celui-ci décide de s'en prendre à sa famille. Nate récupère Polly, sa timide fille de dix ans qu'il connaît à peine, et prend la fuite pour sa sécurité.",,Unknown,2344300.0,,,,70,Excellent (8+),https://media.themoviedb.org/t/p/w220_and_h330_face/nvqW8mOm818QDio3GKKmPLK8kXj.jpg,TMDb
Jaws,Jaws,"Jun 20, 1975",1975,1970s,"Adventure, Horror, Thriller",124.0,Peter Benchley,"Roy Scheider, Robert Shaw, Richard Dreyfuss, Lorraine Gary, Murray Hamilton",5,"À quelques jours du début de la saison estivale, les habitants de la petite station balnéaire d'Amity sont mis en émoi par la découverte sur le littoral du corps atrocement mutilé d'une jeune vacancière. Pour Martin Brody, le chef de la police, il ne fait aucun doute que la jeune fille a été victime d'un requin. Il décide alors d'interdire l'accès aux plages mais se heurte à l'hostilité du maire uniquement intéressé par l'afflux des touristes. Pendant ce temps, le requin continue à semer la terreur le long des côtes et à dévorer les baigneurs…",700000000.0,High (>100M),47065300000.0,46365300000.0,66.24,True,77,Excellent (8+),https://media.themoviedb.org/t/p/w220_and_h330_face/tjbLSFwi0I3phZwh8zoHWNfbsEp.jpg,TMDb
Train to Busan,Train to Busan,"Jul 22, 2016",2016,2010s,"Action, Adventure, Horror, Thriller",118.0,Yeon Sang-ho,"Gong Yoo, Kim Su-an, Yu-mi Jung, Ma Dong-Seok, Choi Woo-shik",5,"Tandis qu'un virus qui transforme tous les êtres vivants en zombies ravage la Corée du Sud, un père et sa fille tentent de survivre dans le dernier train pour Busan, l'unique ville à n'avoir pas encore été contaminée.",850000000.0,High (>100M),8754751800.0,7904751800.0,9.3,True,77,Excellent (8+),https://media.themoviedb.org/t/p/w220_and_h330_face/vNVFt6dtcqnI7hqa6LFBUibuFiw.jpg,TMDb
Home Alone 2: Lost in New York,Home Alone 2: Lost in New York,"Nov 19, 1992",1992,1990s,"Adventure, Comedy",119.0,John Hughes,"Macaulay Culkin, Joe Pesci, Daniel Stern, Catherine O'Hara, John Heard",5,"Après Paris, c'est à Miami que la tribu McCallister décide de passer les fêtes de Noël. À l'aube du jour J, toute la famille est sur le pied de guerre et file a l'aéroport en prenant bien garde de ne pas oublier Kevin. Mais celui-ci s'éclipse pour acheter des piles pour son walkman, il ne retrouve plus les siens et s'embarque par mégarde pour New York...",1800000000.0,High (>100M),35899485000.0,34099485000.0,18.94,True,68,Excellent (8+),https://media.themoviedb.org/t/p/w220_and_h330_face/9CAkQ9nfrDaIAyncWndwg0tfC8g.jpg,TMDb
The Amazing Spider-Man,The Amazing Spider-Man,"Jul 03, 2012",2012,2010s,"Action, Adventure",137.0,James Vanderbilt,"Andrew Garfield, Emma Stone, Rhys Ifans, Denis Leary, Martin Sheen",5,"Abandonné par ses parents lorsqu’il était enfant, Peter Parker a été élevé par son oncle Ben et sa tante May. Il est aujourd’hui au lycée, mais il a du mal à s’intégrer. Comme la plupart des adolescents de son âge, Peter essaie de comprendre qui il est et d’accepter son parcours. Amoureux pour la première fois, lui et Gwen Stacy découvrent les sentiments, l’engagement et les secrets. En retrouvant une mystérieuse mallette ayant appartenu à son père, Peter entame une quête pour élucider la disparition de ses parents, ce qui le conduit rapidement à Oscorp et au laboratoire du docteur Curt Connors, l’ancien associé de son père. Spider-Man va bientôt se retrouver face au Lézard, l’alter ego de Connors. En décidant d’utiliser ses pouvoirs, il va choisir son destin…",21500000000.0,High (>100M),75793066300.0,54293066300.0,2.53,True,67,Excellent (8+),https://media.themoviedb.org/t/p/w220_and_h330_face/jexoNYnPd6vVrmygwF6QZmWPFdu.jpg,TMDb
Sitaare Zameen Par,Sitaare Zameen Par,"Jun 20, 2025",2025,2020s,"Comedy, Drama",155.0,R. S. Prasanna,"Aamir Khan, Genelia D'Souza, Dolly Ahluwalia, Brijendra Kala, Happy Ranajit",5,"Après une conduite en état d'ivresse, un entraîneur de basket-ball arrogant se voit contraint de coacher des adultes neurodivergents dans le cadre d'un service communautaire. Ses préjugés initiaux s'estompent à mesure que ses joueurs lui ouvrent les yeux sur une nouvelle façon de voir la vie.",,Unknown,353243000.0,,,,71,Excellent (8+),https://media.themoviedb.org/t/p/w220_and_h330_face/adYjCJGSNiL7CIaDW3g0Bcg7r2Z.jpg,TMDb
Now You See Me,Now You See Me,"May 31, 2013",2013,2010s,"Crime, Thriller",116.0,Edward Ricourt,"Jesse Eisenberg, Woody Harrelson, Isla Fisher, Dave Franco, Mark Ruffalo",5,"« Les Quatre Cavaliers », un groupe de brillants magiciens et illusionnistes, vient de donner deux spectacles de magie époustouflants: le premier en braquant une banque sur un autre continent, le deuxième en transférant la fortune d’un banquier véreux sur les comptes en banque du public. Deux agents spéciaux du FBI et d’Interpol sont déterminés à les arrêter avant qu’ils ne mettent à exécution leur promesse de réaliser des braquages encore plus audacieux. Ils font appel à Thaddeus, spécialiste reconnu pour expliquer les tours de magie les plus sophistiqués. Alors que la pression s’intensifie, et que le monde entier attend le spectaculaire tour final des Cavaliers, la course contre la montre commence.",7500000000.0,High (>100M),35172398900.0,27672398900.0,3.69,True,73,Excellent (8+),https://media.themoviedb.org/t/p/w220_and_h330_face/tWsNYbrqy1p1w6K9zRk0mSchztT.jpg,TMDb
Succubus,Succubus,"Sep 24, 2024",2024,2020s,"Horror, Thriller",103.0,R.J. Daniel Hanna,"Brendan Bradley, Rachel Cook, Olivia Grace Applegate, Derek Smith, Emily Kincaid",5,"Un nouveau père luttant contre la fatigue, l'insécurité émotionnelle et un mariage raté s'inscrit sur une application de rencontres, mais il tombe sur ce qui pourrait être une présence inhumaine.",,Unknown,,,,,87,Excellent (8+),https://media.themoviedb.org/t/p/w220_and_h330_face/7AfBMebJS8mEtSV5ymdxEPpgvXb.jpg,TMDb
The Illusioned Ones,The Illusioned Ones,"Jan 10, 2025",2025,2020s,Drama,90.0,Roman Perez Jr.,"Jenn Rosa, Angeline Aril, JD Aguas, JC Tan",4,"Emma and Sandra, bound by loss and love, find solace and passion in each other while haunted by the illusions of their past. As reality and fantasy blur, they navigate guilt, desire, and the echoes of their late spouses. How long can they live in a world of make-believe?",,Unknown,,,,,54,Excellent (8+),https://media.themoviedb.org/t/p/w220_and_h330_face/95Iuihq4TWhEiCZXURNUhJFlpe0.jpg,TMDb
Deadpool,Deadpool,"Feb 12, 2016",2016,2010s,"Action, Adventure, Comedy",109.0,Tim Miller,"Ryan Reynolds, Morena Baccarin, Ed Skrein, T.J. Miller, Gina Carano",5,"Deadpool, est l'anti-héros le plus atypique de l'univers Marvel. À l'origine, il s'appelle Wade Wilson : un ancien militaire des Forces Spéciales devenu mercenaire. Après avoir subi une expérimentation hors norme qui va accélérer ses pouvoirs de guérison, il va devenir Deadpool. Armé de ses nouvelles capacités et d'un humour noir survolté, Deadpool va traquer l'homme qui a bien failli anéantir sa vie.",5800000000.0,High (>100M),78283734700.0,72483734700.0,12.5,True,76,Excellent (8+),https://media.themoviedb.org/t/p/w220_and_h330_face/3E53WEZJqP6aM84D8CckXx4pIHw.jpg,TMDb
The Killer,The Killer,"Jun 20, 2022",2022,2020s,"Action, Crime, Thriller",95.0,Choi Jae-hoon,"Jang Hyuk, Lee Seo-young, Bang Eun-jeong, Bruce Khan, Lee Seung-joon",5,"Alors qu’il venait de raccrocher, un tueur à gages de légende est contraint de reprendre du service pour honorer une dernière mission : sauver une adolescente tombée aux mains de dangereux trafiquants.",,Unknown,59511200.0,,,,77,Excellent (8+),https://media.themoviedb.org/t/p/w220_and_h330_face/5IQqdtTq1wH5YJynx86Ysi4sDVt.jpg,TMDb
The Flash,The Flash,"Jun 16, 2023",2023,2020s,"Action, Adventure",144.0,Harry Lampert,"Ezra Miller, Sasha Calle, Michael Keaton, Michael Shannon, Ron Livingston",5,"Les mondes entrent en collision lorsque Barry, alias ""The Flash"", utilise ses pouvoirs pour voyager dans le temps afin de changer les événements du passé. Mais lorsque sa tentative de sauver sa famille modifie par inadvertance le futur, Barry se retrouve piégé dans une réalité où le Général Zod est revenu, avide de destruction, et il n'y a aucun super-héros vers qui se tourner. Enfin, à moins que Barry ne puisse faire sortir un Batman très différent de sa retraite et arrive à sauver un Kryptonien emprisonné… mais pas celui qu'il recherche. En fin de compte, pour sauver le monde dans lequel il se trouve et retourner dans le futur qu'il connaît, le seul espoir de Barry est de foncer. Mais faire le sacrifice ultime suffira-t-il à réinitialiser l'univers ?",22000000000.0,High (>100M),27133331300.0,5133331300.0,0.23,True,66,Excellent (8+),https://media.themoviedb.org/t/p/w220_and_h330_face/rktDFPbfHfUbArZ6OOOKsXcv0Bm.jpg,TMDb
Captain America: Civil War,Captain America: Civil War,"May 06, 2016",2016,2010s,"Action, Adventure",148.0,Joe Simon,"Chris Evans, Robert Downey Jr., Scarlett Johansson, Sebastian Stan, Anthony Mackie",5,"Steve Rogers est désormais à la tête des Avengers, dont la mission est de protéger l’humanité. À la suite d’une de leurs interventions qui a causé d’importants dégâts collatéraux, le gouvernement décide de mettre en place un organisme de commandement et de supervision. Cette nouvelle donne provoque une scission au sein de l’équipe : Steve Rogers reste attaché à sa liberté de s’engager sans ingérence gouvernementale, tandis que d’autres se rangent derrière Tony Stark, qui contre toute attente, décide de se soumettre au gouvernement…",25000000000.0,High (>100M),115504641600.0,90504641600.0,3.62,True,74,Excellent (8+),https://media.themoviedb.org/t/p/w220_and_h330_face/rAGiXaUfPzY7CDEyNKUofk3Kw2e.jpg,TMDb
Sidelined 2: Intercepted,Sidelined 2: Intercepted,"Nov 27, 2025",2025,2020s,"Comedy, Romance",100.0,Justin Wu,"Noah Beck, Siena Agudong, Charlie Gillespie, Drew Ray Tanner, James Van Der Beek",5,"Le quarterback vedette Drayton et la danseuse Dallas traversent des difficultés relationnelles : Drayton se remet d’une blessure, Dallas est en proie à des doutes quant à son avenir. Leur relation est mise à rude épreuve par la distance et les bouleversements personnels.",,Unknown,,,,,73,Excellent (8+),https://media.themoviedb.org/t/p/w220_and_h330_face/sEIP1pTVXa8BJaYSuVeVG3wFN10.jpg,TMDb
