Movie_name,Original_Title,Release_date,Release_year,Release_decade,Genre,Runtime_minutes,Director,Top_Actors,Actor_count,Overview,Budget,Budget_category,Revenue,Profit,ROI,Is_profitable,Rating,Rating_category,Poster_URL,Source
Beauty and the Beast,Beauty and the Beast,"Mar 17, 2017",2017,2010s,"Fantasy, Romance",129.0,Bill Condon,"Emma Watson, Dan Stevens, Luke Evans, Josh Gad, Kevin Kline",5,"Une nouvelle adaptation live du conte ""La Belle et la Bête"".  Belle, jeune fille rêveuse et passionnée de littérature, vit avec son père, un vieil inventeur farfelu. S'étant perdu une nuit dans la fôret, ce dernier se réfugie au château de la Bête, qui le jette au cachot. Ne pouvant supporter de voir son père emprisonné, Belle accepte alors de prendre sa place, ignorant que sous le masque du monstre se cache un Prince Charmant tremblant d'amour pour elle, mais victime d'une terrible malédiction.",16000000000.0,High (>100M),126611596400.0,110611596400.0,6.91,True,70,Excellent (8+),https://media.themoviedb.org/t/p/w220_and_h330_face/hKegSKIDep2ewJWPUQD7u0KqFIp.jpg,TMDb
Venom: The Last Dance,Venom: The Last Dance,"Oct 25, 2024",2024,2020s,"Action, Adventure",109.0,Kelly Marcel,"Tom Hardy, Chiwetel Ejiofor, Juno Temple, Rhys Ifans, Stephen Graham",5,"Eddie et Venom sont en cavale. Chacun est traqué par ses semblables et alors que l'étau se resserre, le duo doit prendre une décision dévastatrice qui annonce la conclusion des aventures d'Eddie et de Venom.",12000000000.0,High (>100M),47893761800.0,35893761800.0,2.99,True,67,Excellent (8+),https://media.themoviedb.org/t/p/w220_and_h330_face/1RaSkWakWBxxYOWRrqmwo2my5zg.jpg,TMDb
Nobody 2,Nobody 2,"Aug 15, 2025",2025,2020s,"Action, Thriller",89.0,Derek Kolstad,"Bob Odenkirk, Connie Nielsen, John Ortiz, Colin Hanks, RZA",5,"Quatre ans après sa malencontreuse altercation avec la mafia russe, Hutch doit toujours 30 millions de dollars à la redoutable organisation et s'efforce de la rembourser en enchaînant sans répit les contrats d'une liste de criminels à abattre aussi interminable qu'internationale. Bien qu'il apprécie le caractère intense de son travail, Hutch se retrouve vite surmené, tout comme sa femme Becca, et ils s'éloignent inexorablement l'un de l'autre.",2500000000.0,High (>100M),4161813500.0,1661813500.0,0.66,True,70,Excellent (8+),https://media.themoviedb.org/t/p/w220_and_h330_face/iyxwxDZCpIm0vIORaHpmgJv2BGF.jpg,TMDb
The Super Mario Bros. Movie,The Super Mario Bros. Movie,"Apr 05, 2023",2023,2020s,"Adventure, Animation, Comedy, Fantasy",92.0,Aaron Horvath,"Chris Pratt, Anya Taylor-Joy, Charlie Day, Jack Black, Keegan-Michael Key",5,"Alors qu’ils tentent de réparer une canalisation souterraine, Mario et son frère Luigi, tous deux plombiers, se retrouvent plongés dans un nouvel univers féerique à travers un mystérieux conduit. Mais lorsque les deux frères sont séparés, Mario s’engage dans une aventure trépidante pour retrouver Luigi. Dans sa quête, il peut compter sur l’aide du champignon Toad, habitant du Royaume Champignon, et les conseils avisés, en matière de techniques de combat, de la Princesse Peach, guerrière déterminée à la tête du Royaume. C’est ainsi que Mario réussit à mobiliser ses propres forces pour aller au bout de sa mission.",10000000000.0,High (>100M),136200000000.0,126200000000.0,12.62,True,76,Excellent (8+),https://media.themoviedb.org/t/p/w220_and_h330_face/qNBAXBIQlnOThrVvA6mA2B5ggV6.jpg,TMDb
Pulp Fiction,Pulp Fiction,"Oct 14, 1994",1994,1990s,"Comedy, Crime, Thriller",154.0,Quentin Tarantino,"John Travolta, Samuel L. Jackson, Uma Thurman, Bruce Willis, Ving Rhames",5,"L’odyssée sanglante et burlesque de petits malfrats dans la jungle d’Hollywood : Deux petits tueurs, un dangereux gangster marié à une camée, un boxeur roublard, des prêteurs sur gages sadiques, un caïd élégant et dévoué, un dealer bon mari et deux tourtereaux à la gâchette facile.",800000000.0,High (>100M),21392876200.0,20592876200.0,25.74,True,85,Excellent (8+),https://media.themoviedb.org/t/p/w220_and_h330_face/vQWk5YBFWF4bZaofAbv0tShwBvQ.jpg,TMDb
"Monsters, Inc.","Monsters, Inc.","Nov 02, 2001",2001,2000s,"Animation, Comedy",92.0,Pete Docter,"John Goodman, Billy Crystal, Mary Gibbs, Steve Buscemi, James Coburn",5,"Monstropolis est une petite ville peuplée de monstres dont la principale source d’énergie provient des cris des enfants. Monstres & Cie est la plus grande usine de traitement de cris de la ville. Grâce au nombre impressionnant de portes de placards dont dispose l’usine, une équipe de monstres d’élite pénètre dans le monde des humains pour terrifier durant la nuit les enfants et récolter leurs hurlements. Le Terreur d’élite le plus réputé de Monstres & Cie s’appelle Jacques Sullivent, alias Sulli. C’est un monstre cornu de 2 m 40 de haut à la fourrure bleu-vert tachetée de violet. Une nuit, alors qu’il se trouve à « l'étage de la Terreur », il s’aperçoit qu’une porte de placard n’a pas été fermée correctement. Pour vérifier que tout est en place, il l’ouvre, permettant sans le vouloir à Bouh, une petite fille, de pénétrer dans son monde.",11500000000.0,High (>100M),57970000000.0,46470000000.0,4.04,True,78,Excellent (8+),https://media.themoviedb.org/t/p/w220_and_h330_face/wFSpyMsp7H0ttERbxY7Trlv8xry.jpg,TMDb
Copper,Copper,"Jul 09, 2025",2025,2020s,Drama,79.0,Nicolás Pereda,"Gabino Rodríguez, Teresa Sánchez, Harold Torres, Francisco Barreiro",4,"On the outskirts of an isolated mining town, Lázaro discovers a dead body. He thinks he has a respiratory illness and doesn’t want to go back to the mine. Rumours, suspicion and desire surround him.",,Unknown,,,,,0,Below Average (<5),https://media.themoviedb.org/t/p/w220_and_h330_face/xXuDJUCU8m83OjyqAh79rbHtrAZ.jpg,TMDb
Harry Potter and the Goblet of Fire,Harry Potter and the Goblet of Fire,"Nov 18, 2005",2005,2000s,"Adventure, Fantasy",157.0,Mike Newell,"Daniel Radcliffe, Rupert Grint, Emma Watson, Brendan Gleeson, Michael Gambon",5,"La quatrième année à l’école de Poudlard est marquée par le « Tournoi des trois sorciers ». Les participants sont choisis par la fameuse « Coupe de feu » qui est à l’origine d’un scandale. Elle sélectionne Harry Potter alors qu’il n’a pas l’âge requis. Accusé de tricherie et mis à mal par une série d’épreuves physiques de plus en plus difficiles, ce dernier sera enfin confronté à Celui dont on ne doit pas prononcer le nom, Lord V.",15000000000.0,High (>100M),89592103600.0,74592103600.0,4.97,True,78,Excellent (8+),https://media.themoviedb.org/t/p/w220_and_h330_face/fECBtHlr0RB3foNHDiCBXeg9Bv9.jpg,TMDb
Harry Potter and the Prisoner of Azkaban,Harry Potter and the Prisoner of Azkaban,"Jun 04, 2004",2004,2000s,"Adventure, Fantasy",142.0,Alfonso Cuarón,"Daniel Radcliffe, Rupert Grint, Emma Watson, Robbie Coltrane, Michael Gambon",5,"Sirius Black, un dangereux sorcier criminel, s’échappe de la sombre prison d’Azkaban avec un seul et unique but : retrouver Harry Potter, en troisième année à l’école de Poudlard. Selon la légende, Black aurait jadis livré les parents du jeune sorcier à leur assassin, Lord Voldemort, et serait maintenant déterminé à tuer Harry…",13000000000.0,High (>100M),78980455400.0,65980455400.0,5.08,True,80,Excellent (8+),https://media.themoviedb.org/t/p/w220_and_h330_face/aWxwnYoe8p2d2fcxOqtvAtJ72Rw.jpg,TMDb
Wild Awakening,Wild Awakening,"Jun 01, 2017",2017,2010s,"Drama, Romance, Thriller",105.0,Joan Fermí Martí,Fabián Castro,1,"À la mort de leurs parents, deux frères reprennent l’affaire familiale : une école d’équitation. Ramon, le contremaître de l’école et son fils Aaron veillent au bon fonctionnement de l’affaire. Mais les problèmes surgissent quand les deux frères tombent amoureux d’Aaron…",,Unknown,,,,,51,Excellent (8+),https://media.themoviedb.org/t/p/w220_and_h330_face/jD9MILmkIeBBoFJbOjHAaCQ3sEA.jpg,TMDb
Five Nights at Freddy's,Five Nights at Freddy's,"Oct 27, 2023",2023,2020s,"Horror, Thriller",110.0,Emma Tammi,"Josh Hutcherson, Piper Rubio, Elizabeth Lail, Matthew Lillard, Mary Stuart Masterson",5,"Mike, jeune homme perturbé, est toujours hanté par la disparition, de son frère dix ans auparavant. Afin de ne pas perdre la garde de sa sœur Abby, il accepte un poste de gardien de nuit dans un restaurant désaffecté, Freddy Fazbear’s Pizzeria. Mais il ne tarde pas à être confronté, la nuit, à des phénomènes surnaturels inexplicables, et bascule dans un univers cauchemardesque…",2000000000.0,High (>100M),29724214500.0,27724214500.0,13.86,True,74,Excellent (8+),https://media.themoviedb.org/t/p/w220_and_h330_face/4dKRTUylqwXQ4VJz0BS84fqW2wa.jpg,TMDb
The Lord of the Rings: The Two Towers,The Lord of the Rings: The Two Towers,"Dec 18, 2002",2002,2000s,"Action, Adventure, Fantasy",180.0,Peter Jackson,"Elijah Wood, Ian McKellen, Viggo Mortensen, Sean Astin, Andy Serkis",5,"La Communauté est dissoute, mais la quête pour détruire l'Anneau Unique se poursuit. Accompagné par son fidèle Sam et guidé par l'étrange Gollum, Frodon cherche un moyen d'entrer en Mordor. Alors que l'armée de Saroumane se met en marche, les autres compagnons de la Communauté se préparent à la bataille. La Guerre de l'Anneau a commencé !",7900000000.0,High (>100M),92628740000.0,84728740000.0,10.73,True,84,Excellent (8+),https://media.themoviedb.org/t/p/w220_and_h330_face/5VTN0pR8gcqV3EPUHHfMGnJYN9L.jpg,TMDb
The Mighty Peking Man,The Mighty Peking Man,"Apr 23, 1999",1999,1990s,"Action, Adventure, Fantasy, Horror",90.0,Ho Meng-Hua,"Evelyne Kraft, Danny Lee, Ku Feng, Lam Wai-Tiu, Hsiao Yao",5,"L'explorateur Johnny est chargé par l'homme d'affaires Lu d'aller capturer un colosse se trouvant dans une jungle en Inde. Là il repère une jolie fille nommée Samantha, amie avec le colosse, qui s'avère être un gorille géant. Ensuite il a l'idée d'emmener Samantha avec le colosse à Hong Kong. Quand ils arrivent à Hong Kong avec le colosse, les choses tournent vite au cauchemar...",,Unknown,,,,,51,Excellent (8+),https://media.themoviedb.org/t/p/w220_and_h330_face/89vf9Gzxj50YdqB9X1zwFMxjNrC.jpg,TMDb
Annihilation,Annihilation,"Feb 23, 2018",2018,2010s,Horror,115.0,Alex Garland,"Natalie Portman, Jennifer Jason Leigh, Gina Rodriguez, Tessa Thompson, Tuva Novotny",5,"Lena, biologiste et ancienne militaire, participe à une mission destinée à comprendre ce qui est arrivé à son mari dans une zone où un mystérieux et sinistre phénomène se propage le long des côtes américaines. Une fois sur place, les membres de l’expédition découvrent que paysages et créatures ont subi des mutations, et malgré la beauté des lieux, le danger règne et menace leur vie, mais aussi leur intégrité mentale.",4000000000.0,High (>100M),4307091500.0,307091500.0,0.08,True,64,Excellent (8+),https://media.themoviedb.org/t/p/w220_and_h330_face/4YRplSk6BhH6PRuE9gfyw9byUJ6.jpg,TMDb
Tae Guk Gi: The Brotherhood of War,Tae Guk Gi: The Brotherhood of War,"Sep 03, 2004",2004,2000s,"Action, Adventure, Drama, War",140.0,Kang Je-gyu,"Jang Dong-gun, Won Bin, Lee Eun-ju, Gong Hyung-jin, Lee Young-ran",5,"Séoul, Corée du Sud, au début des années 50.Jin-tae est un cireur de chaussures qui consacre ses modestes ressources à l'éducation de son frère cadet, Jin-suk, et espère envoyer prochainement celui-ci à l'Université. Leur mère, veuve et handicapée, tient une échoppe avec l'aide de la fiancée de Jin-tae, Young-shin, qu'elle a recueillie quelques années plus tôt. Tous les espoirs de cette famille s'effondrent brutalement le 25 juin 1950, lorsque la guerre éclate. Jin-suk est recruté de force et envoyé sur le front. Jin-tae tente vainement d'intercéder, et subit le même sort. Les deux frères rejoignent cette armée du Sud, mal équipée, mal nourrie, mal organisée, harcelée jour et nuit par un ennemi supérieur en nombre et en force...",150000000.0,High (>100M),,,,,80,Excellent (8+),https://media.themoviedb.org/t/p/w220_and_h330_face/vyG8qpimh3XSlxc6OmPq8LJRJl.jpg,TMDb
Conjuring Tapes,Conjuring Tapes,"Apr 10, 2025",2025,2020s,"Horror, Mystery",79.0,Robert Livings,"Samantha Laurenti, Brenda Yanez, Robert Felsted Jr., Greg Sestero",4,"While sorting through their late friend's belongings, two women discover VHS tapes showing them in haunting, unfamiliar scenes, each one drawing them into the grasp of a mysterious, malevolent entity.",,Unknown,,,,,51,Excellent (8+),https://media.themoviedb.org/t/p/w220_and_h330_face/puPN6uC5NpbAQW8dDovGkJ79arn.jpg,TMDb
"The Chronicles of Narnia: The Lion, the Witch and the Wardrobe","The Chronicles of Narnia: The Lion, the Witch and the Wardrobe","Dec 09, 2005",2005,2000s,"Adventure, Fantasy",140.0,Andrew Adamson,"William Moseley, Anna Popplewell, Skandar Keynes, Georgie Henley, Liam Neeson",5,"Le Monde de Narnia : chapitre 1 conte la lutte entre le bien et le mal qui oppose le magnifique lion Aslan aux forces des ténèbres dans le monde magique de Narnia. Grâce à ses sombres pouvoirs, la Sorcière Blanche a plongé Narnia dans un hiver qui dure depuis un siècle, mais une prédiction révèle que quatre enfants aideront Aslan à rompre la malédiction. Lorsque Lucy, Susan, Edmund et Peter Pevensie, quatre frères et sœurs, découvrent ce monde enchanté en y pénétrant à travers une armoire, tout est en place pour une bataille de proportions épiques…",18000000000.0,High (>100M),74501311500.0,56501311500.0,3.14,True,71,Excellent (8+),https://media.themoviedb.org/t/p/w220_and_h330_face/iREd0rNCjYdf5Ar0vfaW32yrkm.jpg,TMDb
Captain Hook: The Cursed Tides,Captain Hook: The Cursed Tides,"Jul 11, 2025",2025,2020s,"Action, Adventure, Horror",90.0,Lars Janssen,"Sean Cronin, Ewen Weatherburn, Cameron Ashplant, Richard Rowden, Destiny Viva",5,"Après sa défaite face à l'amiral Smee, le capitaine Hook se cache à Eldritch Landing et s'allie au forgeron Silas Blackweather pour venger la mort de sa sœur. Va-t-il obtenir sa vengeance ?",,Unknown,,,,,50,Excellent (8+),https://media.themoviedb.org/t/p/w220_and_h330_face/oKE2xPJs87V9DbDmoo8igAsDeH1.jpg,TMDb
Pirates of the Caribbean: The Curse of the Black Pearl,Pirates of the Caribbean: The Curse of the Black Pearl,"Jul 09, 2003",2003,2000s,"Action, Adventure, Fantasy",143.0,Gore Verbinski,"Johnny Depp, Geoffrey Rush, Orlando Bloom, Keira Knightley, Jack Davenport",5,"Dans la mer des Caraïbes, au XVIIe siècle, Jack Sparrow, flibustier gentleman, voit sa vie idyllique basculer le jour où son ennemi, le perfide capitaine Barbossa, lui vole son bateau, le Black Pearl, puis attaque la ville de Port Royal, enlevant au passage la très belle fille du gouverneur, Elizabeth Swann. L'ami d'enfance de celle-ci, Will Turner, se joint à Jack pour se lancer aux trousses du capitaine. Mais Will ignore qu'une malédiction frappe Barbossa et ses pirates. Lorsque la lune brille, ils se transforment en morts-vivants. Leur terrible sort ne prendra fin que le jour où le fabuleux trésor qu'ils ont amassé sera restitué…",14000000000.0,High (>100M),65501122400.0,51501122400.0,3.68,True,78,Excellent (8+),https://media.themoviedb.org/t/p/w220_and_h330_face/poHwCZeWzJCShH7tOjg8RIoyjcw.jpg,TMDb
Eternity,Eternity,"Nov 26, 2025",2025,2020s,"Comedy, Drama, Romance",112.0,David Freyne,"Elizabeth Olsen, Miles Teller, Callum Turner, Da'Vine Joy Randolph, John Early",5,"Vieux couple marié depuis des années, Joan et Larry meurent à une semaine d'intervalle. À leur arrivée dans l’au-delà, ils découvrent que chaque âme doit choisir où - et avec qui - passer l’éternité. Alors qu’ils s’apprêtent à rejoindre leur paradis commun, un fantôme du passé réapparaît : Luke, le premier mari de Joan, mort durant la guerre de Corée, qui l’attend patiemment depuis 67 ans. Joan doit alors faire un choix impossible : le père de ses enfants, avec qui elle a partagé une vie entière, ou son amour passionné de jeunesse.",1200000000.0,High (>100M),3286784800.0,2086784800.0,1.74,True,71,Excellent (8+),https://media.themoviedb.org/t/p/w220_and_h330_face/o8pg20G67BGmQvRkXwstNre062J.jpg,TMDb
Code 3,Code 3,"Sep 12, 2025",2025,2020s,"Action, Comedy",104.0,Christopher Leone,"Rainn Wilson, Lil Rel Howery, Aimee Carrero, Yvette Nicole Brown, Rob Riggle",5,"Lors de son dernier jour de travail, un ambulancier paramédical épuisé est chargé de former son remplaçant enthousiaste mais inexpérimenté. Ce qui commence comme une nuit de routine se transforme rapidement en une odyssée chaotique.",,Unknown,,,,,70,Excellent (8+),https://media.themoviedb.org/t/p/w220_and_h330_face/gIAYMDb5mIAeCAj76q1sRsKjkzo.jpg,TMDb
The Godfather Part II,The Godfather Part II,"Dec 20, 1974",1974,1970s,"Crime, Drama",202.0,Francis Ford Coppola,"Al Pacino, Robert Duvall, Diane Keaton, Robert De Niro, John Cazale",5,"Depuis la mort de Don Vito Corleone, son fils Michael règne sur la famille. Amené à négocier avec la mafia juive, il perd alors le soutien d'un de ses lieutenants, Frankie Pentageli. Échappant de justesse à un attentat, Michael tente de retrouver le coupable, soupçonnant Hyman Roth, le chef de la mafia juive. Vito Corleone, immigrant italien, arrive à New York au début du siècle ; très vite, il devient un des caïds du quartier, utilisant la violence comme moyen de régler toutes les affaires. Seul au départ, il bâtit peu à peu un véritable empire, origine de la fortune de la famille des Corleone.",1300000000.0,High (>100M),10260000000.0,8960000000.0,6.89,True,86,Excellent (8+),https://media.themoviedb.org/t/p/w220_and_h330_face/hek3koDUyRQk7FIhPXsa6mT2Zc3.jpg,TMDb
Marco,Marco,"Dec 20, 2024",2024,2020s,"Action, Crime, Thriller",145.0,Haneef Adeni,"Unni Mukundan, Siddique, Ishan Shoukath, Jagadish, Abhimanyu Thilakan",5,"The adoptive son of the Adattu family, Marco, sets off on a ruthless quest for vengeance after his brother is brutally murdered, finding only betrayal, loss and unimaginable brutality at every step.",346700000.0,High (>100M),1155900000.0,809200000.0,2.33,True,65,Excellent (8+),https://media.themoviedb.org/t/p/w220_and_h330_face/il3ao5gcF6fZNqo1o9o7lusmEyU.jpg,TMDb
Sonic the Hedgehog 3,Sonic the Hedgehog 3,"Dec 20, 2024",2024,2020s,"Action, Comedy",100.0,Patrick Casey,"Jim Carrey, Ben Schwartz, Keanu Reeves, Idris Elba, Colleen O'Shaughnessey",5,"Sonic, Knuckles et Tails sont à nouveau réunis face à un puissant nouvel adversaire, Shadow, un mystérieux vilain doté de pouvoirs comme ils n'en ont encore jamais vu. Leurs habiletés étant toutes surclassées, l'Équipe Sonic doit tenter une alliance improbable dans l'espoir d'arrêter Shadow et de protéger la planète.",12200000000.0,High (>100M),49216260400.0,37016260400.0,3.03,True,76,Excellent (8+),https://media.themoviedb.org/t/p/w220_and_h330_face/d8Ryb8AunYAuycVKDp5HpdWPKgC.jpg,TMDb
The Divine Sarah Bernhardt,The Divine Sarah Bernhardt,"Dec 18, 2024",2024,2020s,"Drama, Romance",98.0,Guillaume Nicloux,"Sandrine Kiberlain, Laurent Lafitte, Amira Casar, Pauline Étienne, Mathilde Ollivier",5,"Paris 1896. Sarah Bernhardt est au sommet de sa gloire. Icône de son époque et première star mondiale, la comédienne est aussi une amoureuse libre et moderne qui défie les conventions. Découvrez la femme derrière la légende.",,Unknown,,,,,60,Excellent (8+),https://media.themoviedb.org/t/p/w220_and_h330_face/bo74X1ZB4ZpcHND0nYnJ5oJ7ovs.jpg,TMDb
Back to the Past,Back to the Past,"Jan 30, 2026",2026,2020s,"Action, Comedy",107.0,Ng Yuen-Fai,"Louis Koo, Raymond Lam Fung, Bai Baihe, Jessica Hsuan, Sonija Kwok Sin-Nae",5,"In the Qin Dynasty, time-traveller Hong Siu-lung has lived in seclusion with his family for twenty years. Yet every step he takes remains under the watchful eye of his former disciple, now the Qin Emperor. On the brink of ultimate power after conquering the six warring states, the emperor is suddenly ambushed by a mysterious team wielding advanced weapons clearly originating from Hong’s time. Drawn together by fate again, Hong and Qin Emperor are forced to confront the long-buried conflict between them, because the future now depends on how they settle their past.",,Unknown,,,,,70,Excellent (8+),https://media.themoviedb.org/t/p/w220_and_h330_face/h3OUaPfCaFmzwB2eMHik50RsXlP.jpg,TMDb
100 METERS,100 METERS,"Oct 08, 2025",2025,2020s,"Animation, Drama",106.0,Kenji Iwaisawa,"Tori Matsuzaka, Shōta Sometani, Yuma Uchida, Kōki Uchiyama, Kenjirō Tsuda",5,"Un coureur talentueux entraîne un camarade de classe déterminé mais peu doué, sans se rendre compte qu'il est en train de créer un rival qui le défiera sur la piste pendant des années.",,Unknown,303300000.0,,,,77,Excellent (8+),https://media.themoviedb.org/t/p/w220_and_h330_face/w2pzrRTevXrW3vgIK4CCYaXvtIc.jpg,TMDb
The Hobbit: The Battle of the Five Armies,The Hobbit: The Battle of the Five Armies,"Dec 17, 2014",2014,2010s,"Action, Adventure, Fantasy",144.0,Peter Jackson,"Ian McKellen, Martin Freeman, Richard Armitage, Orlando Bloom, Evangeline Lilly",5,"Atteignant enfin la Montagne Solitaire, Thorin et les Nains, aidés par Bilbon le Hobbit, ont réussi à récupérer leur royaume et leur trésor. Ils ont également réveillé le dragon Smaug qui déchaîne désormais sa colère sur les habitants de Lac-ville. À présent, les Nains, les Elfes, les Humains mais aussi les Wrags et les Orques menés par le Nécromancien, convoitent les richesses de la Montagne Solitaire.",25000000000.0,High (>100M),95601978800.0,70601978800.0,2.82,True,73,Excellent (8+),https://media.themoviedb.org/t/p/w220_and_h330_face/xT98tLqatZPQApyRmlPL12LtiWp.jpg,TMDb
Our Fault,Our Fault,"Oct 15, 2025",2025,2020s,"Drama, Romance",112.0,Domingo González,"Nicole Wallace, Gabriel Guevara, Gabriela Andrada, Marta Hazas, Goya Toledo",5,"Le mariage de Jenna et Lion marque les retrouvailles entre Noah et Nick après leur rupture. L'incapacité de Nick à pardonner à Noah représente un obstacle difficile à surmonter. Lui, héritier des affaires de son grand-père, et elle, qui débute sa carrière, évitent de raviver la flamme entre eux. Mais, maintenant qu'ils se retrouvent, l'amour l'emportera-t-il sur le ressentiment ?",,Unknown,,,,,74,Excellent (8+),https://media.themoviedb.org/t/p/w220_and_h330_face/yzqHt4m1SeY9FbPrfZ0C2Hi9x1s.jpg,TMDb
Harry Potter and the Chamber of Secrets,Harry Potter and the Chamber of Secrets,"Nov 15, 2002",2002,2000s,"Adventure, Fantasy",161.0,Chris Columbus,"Daniel Radcliffe, Rupert Grint, Emma Watson, Kenneth Branagh, Toby Jones",5,"Après de très mauvaises vacances passées chez ses odieux oncle et tante et son affreux cousin, Harry rejoint, non sans mal, l'École des Sorciers où, avec ses amis Ron et Hermione et l'aide ponctuelle de nouveaux venus, il parvient à élucider le mystère de la Chambre des secrets, malgré les pièges tendus par ses ennemis et sans le concours de Lockhart, un nouveau professeur fanfaron et lâche, chargé pourtant de vaincre les Forces du Mal.",10000000000.0,High (>100M),87668848200.0,77668848200.0,7.77,True,77,Excellent (8+),https://media.themoviedb.org/t/p/w220_and_h330_face/sdEOH0992YZ0QSxgXNIGLq1ToUi.jpg,TMDb
Spider-Man: Far From Home,Spider-Man: Far From Home,"Jul 02, 2019",2019,2010s,"Action, Adventure",129.0,Jon Watts,"Tom Holland, Jake Gyllenhaal, Samuel L. Jackson, Marisa Tomei, Jon Favreau",5,Peter et ses amis passent leurs vacances d’été en Europe. Mais ils n’auront pas vraiment l’occasion de se reposer puisque Peter accepte d’aider Nick Fury pour débusquer les mystérieuses créatures qui sont la cause des catastrophes naturelles qui frappent le continent.,16000000000.0,High (>100M),113272322600.0,97272322600.0,6.08,True,74,Excellent (8+),https://media.themoviedb.org/t/p/w220_and_h330_face/4q2NNj4S5dG2RLF9CpXsej7yXl.jpg,TMDb
Border Hunters,Border Hunters,"Oct 20, 2025",2025,2020s,"Action, Thriller",82.0,Ruben Islas,"Dean Norris, Julio Macias, Danforth Comins",3,"Lorsqu'un jeune Américain meurt d'une overdose au Mexique, la lutte anti-drogue revient au premier plan. Abraham Woodhill, un ancien espion, est alors déployé en urgence pour démanteler les cartels responsables. Pour garantir le succès de sa mission, il va devoir collaborer avec le tristement célèbre Jack Byrne, un ancien agent emprisonné. Ensemble, ils vont affronter la jungle, les villages hostiles et les dangereux bastions des cartels au péril de leur vie.",,Unknown,,,,,64,Excellent (8+),https://media.themoviedb.org/t/p/w220_and_h330_face/6TNFZnJ5CU0uFQxGaO9dbqriiI7.jpg,TMDb
Spider-Man,Spider-Man,"May 03, 2002",2002,2000s,Action,121.0,Sam Raimi,"Tobey Maguire, Willem Dafoe, Kirsten Dunst, James Franco, Cliff Robertson",5,"Orphelin, Peter Parker est élevé par sa tante May et son oncle Ben dans le quartier Queens de New York. Tout en poursuivant ses études de biophysique à l'université, il trouve un emploi de photographe au journal Daily Bugle. Cependant, après avoir été mordu par une araignée radioactive, ce dernier est sujet à des transformations physiques : son agilité et sa force se sont accrues, et il se voit doter de pouvoirs surnaturels. Peter décide alors de participer à un combat de catch qu'il remporte avec une facilité déconcertante. Mais l'organisateur du spectacle, décrétant qu'il y a eu tricherie, refuse de lui remettre le prix de 3 000 dollars qui lui revient de droit. Au même moment, l'homme d'affaires mégalomane Norman Osborn expérimente sur lui-même de dangereuses solutions chimiques. Des mutations s'opèrent bientôt sur son corps et son esprit. Il se transforme alors en Bouffon Vert.",13900000000.0,High (>100M),82170855100.0,68270855100.0,4.91,True,73,Excellent (8+),https://media.themoviedb.org/t/p/w220_and_h330_face/kjdJntyBeEvqm9w97QGBdxPptzj.jpg,TMDb
