Movie_name,Original_Title,Release_date,Release_year,Release_decade,Genre,Runtime_minutes,Director,Top_Actors,Actor_count,Overview,Budget,Budget_category,Revenue,Profit,ROI,Is_profitable,Rating,Rating_category,Poster_URL,Source
The Long Walk,The Long Walk,"Sep 12, 2025",2025,2020s,"Horror, Thriller",108.0,Francis Lawrence,"Cooper Hoffman, David Jonsson, Garrett Wareing, Tut Nyuot, Charlie Plummer",5,"Dans une Amérique totalitaire instaurée après une longue guerre fratricide, 50 jeunes hommes participent à une marche d'endurance de plus de 500 kilomètres, filmée et diffusée en direct. Les marcheurs ont l'obligation de conserver un rythme constant, avec interdiction formelle de s'arrêter. Après trois avertissements consécutifs, les contrevenants sont froidement abattus. Un seul en sortira vivant, avec une somme faramineuse et un prix de son choix. Habité par un motif secret, le jeune Raymond Garraty tente sa chance, nouant sur la route un fort lien d'amitié avec l'Afro-Américain Peter McVries.",2000000000.0,High (>100M),6287169700.0,4287169700.0,2.14,True,69,Excellent (8+),https://media.themoviedb.org/t/p/w220_and_h330_face/wobVTa99eW0ht6c1rNNzLkazPtR.jpg,TMDb
Relationship Goals,Relationship Goals,"Feb 04, 2026",2026,2020s,"Comedy, Romance",96.0,Linda Mendoza,"Kelly Rowland, Method Man, Robin Thede, Annie Gonzalez, Dennis Haysbert",5,"La productrice Leah Caldwell veut devenir la première femme à diriger la principale émission matinale de New York, mais son ex Jarrett Roy est en concurrence pour le même poste. Il dit être changé par le livre « La relation idéale », qui devient un thème récurrent quand ses amis s'en inspirent aussi. Leah se concentre sur sa carrière, mais l'alchimie avec son ex remet en question ses priorités.",,Unknown,,,,,55,Excellent (8+),https://media.themoviedb.org/t/p/w220_and_h330_face/o7dVxvZIKnAB7k1eeeWp2k14Es7.jpg,TMDb
Sneakers,Sneakers,"Sep 09, 1992",1992,1990s,"Comedy, Crime, Drama",125.0,Phil Alden Robinson,"Robert Redford, Sidney Poitier, David Strathairn, Dan Aykroyd, River Phoenix",5,"Deux jeunes génies de l'informatique, Martin Bishop et son ami Cosmo, arrêtés dans les années soixante pour avoir infiltré le réseau du Parti républicain, vont se retrouver vingt ans plus tard. Bishop dirige une société spécialisée dans la protection des données et des systèmes informatiques. Il est contacté par la National Security Agency pour une mission qu'il ne peut refuser. Il s'agit de dérober un logiciel capable de déchiffrer n'importe quel programme chiffré. Il va devoir affronter son ancien ami Cosmo, passé au service d'une puissante organisation criminelle.",2300000000.0,High (>100M),10523269100.0,8223269100.0,3.58,True,69,Excellent (8+),https://media.themoviedb.org/t/p/w220_and_h330_face/l2pIGwCvpZEpBuMb55YBl6A04Jv.jpg,TMDb
Tell Me Softly,Tell Me Softly,"Dec 12, 2025",2025,2020s,"Drama, Romance",119.0,Denis Rovira van Boekholt,"Alícia Falcó, Fernando Lindez, Jan Buxaderas, Eve Ryan",4,"Tout est sous contrôle dans la vie de Kamila : études, vie sociale, son image... Mais le retour inattendu de ses voisins, les frères Di Bianco, après 7 ans d'absence, change tout. Thiago lui avait volé son premier baiser, Taylor était son meilleur ami, mais leur retour va chambouler l'univers de Kami. Arriveront-ils à surmonter le passé qui les lie ? Ou les choses vont-elles encore s'envenimer ?",,Unknown,,,,,62,Excellent (8+),https://media.themoviedb.org/t/p/w220_and_h330_face/6Z37lW0JfLdeFcgH9yaTyg6B9A6.jpg,TMDb
Cars 3,Cars 3,"Jun 16, 2017",2017,2010s,"Adventure, Animation, Comedy, Drama",109.0,Brian Fee,"Owen Wilson, Cristela Alonzo, Chris Cooper, Nathan Fillion, Larry the Cable Guy",5,"Dépassé par une nouvelle génération de coureurs auto emmenés par l'arrogant Jackson Storm, le légendaire Flash McQueen est soudain mis sur le bas-côté. Pour revenir dans la course, il aura besoin de la jeune technicienne Cruz Ramirez, de l'inspiration du fabuleux Hudson Hornet et de quelques rebondissements inattendus et tours du destin.",17500000000.0,High (>100M),38392527600.0,20892527600.0,1.19,True,69,Excellent (8+),https://media.themoviedb.org/t/p/w220_and_h330_face/zg5RDxvIIAKsucjuU2EZJIHEIvz.jpg,TMDb
London Calling,London Calling,"Sep 19, 2025",2025,2020s,"Action, Comedy, Crime, Thriller",114.0,Allan Ungar,"Josh Duhamel, Aidan Gillen, Jeremy Ray Taylor, Rick Hoffman, Arnold Vosloo",5,"Après avoir raté un coup, Tommy Ward s'enfuit à Los Angeles et conclut un marché : devenir le mentor du fils maladroit de son patron en échange d'un retour chez lui. Mais une mission de routine se transforme en une nuit de fusillades, de tueurs et de chaos, tandis que ce duo étrange lutte pour survivre et obtenir la rédemption.",,Unknown,,,,,67,Excellent (8+),https://media.themoviedb.org/t/p/w220_and_h330_face/cpQ4VxBJO7vGV3IUdKzSNf4tH9V.jpg,TMDb
Train to Busan,Train to Busan,"Jul 22, 2016",2016,2010s,"Action, Adventure, Horror, Thriller",118.0,Yeon Sang-ho,"Gong Yoo, Kim Su-an, Yu-mi Jung, Ma Dong-Seok, Choi Woo-shik",5,"Tandis qu'un virus qui transforme tous les êtres vivants en zombies ravage la Corée du Sud, un père et sa fille tentent de survivre dans le dernier train pour Busan, l'unique ville à n'avoir pas encore été contaminée.",850000000.0,High (>100M),8754751800.0,7904751800.0,9.3,True,77,Excellent (8+),https://media.themoviedb.org/t/p/w220_and_h330_face/vNVFt6dtcqnI7hqa6LFBUibuFiw.jpg,TMDb
Spider-Man 3,Spider-Man 3,"May 03, 2007",2007,2000s,"Action, Adventure",139.0,Sam Raimi,"Tobey Maguire, Kirsten Dunst, James Franco, Thomas Haden Church, Topher Grace",5,"Peter Parker a retrouvé un équilibre de vie et souhaite épouser Mary Jane. Lors d'une nuit au parc, alors que Peter et Mary Jane sont ensemble, une petite météorite tombe près du lieu où ils se trouvent. Celle-ci laisse échapper une matière visqueuse qui s'attache discrètement à la mobylette de Peter. Pendant ce temps, Flint Marko s'échappe de prison. Lors de sa fuite, il tombe dans un accélérateur de particules qui fond son corps avec le sable. Le meilleur ami de Peter, Harry Osborn, veut venger la mort de son père, croyant que Spider-Man est responsable de son décès, il l'attaque.",25800000000.0,High (>100M),89498337300.0,63698337300.0,2.47,True,65,Excellent (8+),https://media.themoviedb.org/t/p/w220_and_h330_face/qFmwhVUoUSXjkKRmca5yGDEXBIj.jpg,TMDb
Toy Story 3,Toy Story 3,"Jun 18, 2010",2010,2010s,"Animation, Comedy",103.0,Lee Unkrich,"Tom Hanks, Tim Allen, Joan Cusack, Don Rickles, Wallace Shawn",5,"Woody, Buzz l’Éclair et le reste des jouets reviennent dans une toute nouvelle aventure avec quelques nouveaux visages dont Ken et Barbie, le hérisson La Brosse et l’ours Lotso. Andy se prépare à partir pour l’université et Woody, Buzz, Jessie et les autres jouets se demandent ce qu’ils vont devenir. Quand ils arrivent à Sunnyside, c’est le début d’une nouvelle aventure.",20000000000.0,High (>100M),106731610100.0,86731610100.0,4.34,True,78,Excellent (8+),https://media.themoviedb.org/t/p/w220_and_h330_face/AbbXspMOwdvwWZgVN0nabZq03Ec.jpg,TMDb
Ant-Man,Ant-Man,"Jul 17, 2015",2015,2010s,"Action, Adventure",118.0,Joe Cornish,"Paul Rudd, Michael Douglas, Evangeline Lilly, Corey Stoll, Bobby Cannavale",5,"L'histoire d'Ant-Man est celle d'un petit escroc du nom de Scott Lang. Doté d'une capacité étonnante - celle de rétrécir à volonté tout en démultipliant sa force - ce dernier doit embrasser la part de héros qui est en lui afin d'aider son mentor, le docteur Hank Pym, à protéger d'une nouvelle génération de redoutables menaces le secret du spectaculaire costume d'Ant-Man. Contre des obstacles en apparence insurmontables, Pym et Lang, doivent mettre au point - et réussir - un audacieux cambriolage qui pourrait sauver le monde d'une issue fatale…",13000000000.0,High (>100M),51931196500.0,38931196500.0,2.99,True,71,Excellent (8+),https://media.themoviedb.org/t/p/w220_and_h330_face/rQRnQfUl3kfp78nCWq8Ks04vnq1.jpg,TMDb
Logan,Logan,"Mar 03, 2017",2017,2010s,"Action, Drama",138.0,James Mangold,"Hugh Jackman, Dafne Keen, Patrick Stewart, Elizabeth Rodriguez, Boyd Holbrook",5,"Dans un futur proche, un certain Logan, épuisé de fatigue, s’occupe d’un Professeur X souffrant, dans un lieu gardé secret à la frontière Mexicaine. Mais les tentatives de Logan pour se retrancher du monde et rompre avec son passé vont s’épuiser lorsqu’une jeune mutante traquée par de sombres individus va se retrouver soudainement face à lui.",9700000000.0,High (>100M),61902143600.0,52202143600.0,5.38,True,78,Excellent (8+),https://media.themoviedb.org/t/p/w220_and_h330_face/fnbjcRDYn6YviCcePDnGdyAkYsB.jpg,TMDb
It Was Just an Accident,It Was Just an Accident,"Oct 15, 2025",2025,2020s,"Crime, Drama, Mystery, Thriller",102.0,Jafar Panahi,"Vahid Mobasseri, Mariam Afshari, Ebrahim Azizi, Hadis Pakbaten, Majid Panahi",5,"Une famille est impliquée dans un petit accident de voiture, mais un inconnu va bouleverser leur journée.",600000000.0,High (>100M),960279300.0,360279300.0,0.6,True,72,Excellent (8+),https://media.themoviedb.org/t/p/w220_and_h330_face/eNYGj2DG3n8OrVPTfYunpPW9uas.jpg,TMDb
Taxi Driver,Taxi Driver,"Feb 09, 1976",1976,1970s,"Crime, Drama",115.0,Martin Scorsese,"Robert De Niro, Jodie Foster, Cybill Shepherd, Harvey Keitel, Peter Boyle",5,"Vétéran de la Guerre du Vietnam, Travis Bickle est chauffeur de taxi dans la ville de New York. Ses rencontres nocturnes et la violence quotidienne dont il est témoin lui font peu à peu perdre la tête. Il se charge bientôt de délivrer une prostituée mineure de ses souteneurs.",190000000.0,High (>100M),2857963600.0,2667963600.0,14.04,True,81,Excellent (8+),https://media.themoviedb.org/t/p/w220_and_h330_face/ekstpH614fwDX8DUln1a2Opz0N8.jpg,TMDb
Despicable Me,Despicable Me,"Jul 09, 2010",2010,2010s,"Action, Animation, Comedy",95.0,Chris Renaud,"Steve Carell, Jason Segel, Miranda Cosgrove, Dana Gaier, Elsie Fisher",5,"Dans un charmant quartier résidentiel délimité par des clôtures de bois blanc et orné de rosiers fleurissants se dresse une bâtisse noire entourée d’une pelouse en friche. Cette façade sinistre cache un secret : Gru, un méchant vilain, entouré d’une myriade de sous‐fifres et armé jusqu’aux dents, qui, à l’insu du voisinage, complote le plus gros casse de tous les temps : voler la lune (Oui, la lune !)… Gru affectionne toutes sortes de sales joujoux. Il possède une multitude de véhicules de combat aérien et terrestre et un arsenal de rayons immobilisants et rétrécissants avec lesquels il anéantit tous ceux qui osent lui barrer la route… jusqu’au jour où il tombe nez à nez avec trois petites orphelines qui voient en lui quelqu’un de tout à fait différent : un papa. Le plus grand vilain de tous les temps se retrouve confronté à sa plus dure épreuve : trois fillettes prénommées Margo, Édith et Agnès.",6900000000.0,High (>100M),54328425600.0,47428425600.0,6.87,True,73,Excellent (8+),https://media.themoviedb.org/t/p/w220_and_h330_face/b1BT309QWjtFUlJPLmXmrcHOWEL.jpg,TMDb
Train Dreams,Train Dreams,"Nov 07, 2025",2025,2020s,Drama,102.0,Clint Bentley,"Joel Edgerton, Felicity Jones, Nathaniel Arcand, Clifton Collins Jr., John Diehl",5,"Entre histoire d'amour et deuil, un bûcheron vit un paisible état de grâce dans le monde en pleine mutation du début du 20e siècle en Amérique.",1000000000.0,High (>100M),,,,,73,Excellent (8+),https://media.themoviedb.org/t/p/w220_and_h330_face/wfzYOVdafdbD1d3SxNqiBtV2Yhx.jpg,TMDb
Her,Her,"Dec 18, 2013",2013,2010s,"Drama, Romance",126.0,Spike Jonze,"Joaquin Phoenix, Scarlett Johansson, Lynn Adrianna, Lisa Renee Pitts, Gabe Gomez",5,"Los Angeles, dans un futur proche. Theodore Twombly, un homme sensible au caractère complexe, est inconsolable suite à une rupture difficile. Il fait alors l'acquisition d'un programme informatique ultramoderne, capable de s'adapter à la personnalité de chaque utilisateur. En lançant le système, il fait la connaissance de 'Samantha', une voix féminine intelligente, intuitive et étonnamment drôle. Les besoins et les désirs de Samantha grandissent et évoluent, tout comme ceux de Theodore, et peu à peu, ils tombent amoureux…",2300000000.0,High (>100M),4735125100.0,2435125100.0,1.06,True,78,Excellent (8+),https://media.themoviedb.org/t/p/w220_and_h330_face/eCOtqtfvn7mxGl6nfmq4b1exJRc.jpg,TMDb
Léon: The Professional,Léon: The Professional,"Nov 18, 1994",1994,1990s,"Action, Crime, Drama",110.0,Luc Besson,"Jean Reno, Natalie Portman, Gary Oldman, Danny Aiello, Peter Appel",5,Léon est un tueur professionnel redoutable et insaisissable. Il vit seul à New York avec sa plante verte et ses habitudes jusqu'au jour où une petite Mathilda de douze ans sonne à sa porte et fait irruption dans sa vie.,1600000000.0,High (>100M),4528497400.0,2928497400.0,1.83,True,83,Excellent (8+),https://media.themoviedb.org/t/p/w220_and_h330_face/bxB2q91nKYp8JNzqE7t7TWBVupB.jpg,TMDb
Play Dirty,Play Dirty,"Oct 01, 2025",2025,2020s,Crime,127.0,Shane Black,"Mark Wahlberg, LaKeith Stanfield, Rosa Salazar, Keegan-Michael Key, Chukwudi Iwuji",5,"Un voleur nommé Parker tente de monter dans un braquage majeur dans lequel il doit déjouer un dictateur sud-américain, la mafia new-yorkaise et l'un des hommes les plus riches du monde.",250000000.0,High (>100M),,,,,66,Excellent (8+),https://media.themoviedb.org/t/p/w220_and_h330_face/ovZ0zq0NwRghtWI1oLaM0lWuoEw.jpg,TMDb
Prey,Prey,"Aug 02, 2022",2022,2020s,"Action, Thriller",99.0,Dan Trachtenberg,"Amber Midthunder, Dakota Beavers, Michelle Thrush, Stormee Kipp, Julian Black Antelope",5,"Lorsque le danger menace son camp, la féroce et très habile guerrière Comanche Naru se met en route pour protéger son peuple. Mais la proie qu'elle traque s'avère être un prédateur extraterrestre très évolué doté d'un arsenal techniquement avancé.",6500000000.0,High (>100M),,,,,77,Excellent (8+),https://media.themoviedb.org/t/p/w220_and_h330_face/2FKjLRt7oK1bRRIrxgWmthbBdFh.jpg,TMDb
Thor: Ragnarok,Thor: Ragnarok,"Nov 03, 2017",2017,2010s,"Action, Adventure, Comedy",130.0,Taika Waititi,"Chris Hemsworth, Mark Ruffalo, Tom Hiddleston, Cate Blanchett, Idris Elba",5,"Thor est emprisonné de l’autre côté de l’univers sans son puissant marteau et se retrouve engagé dans une course contre le temps pour rejoindre Asgard et arrêter Ragnarok – la destruction de son monde natal et la fin de la civilisation Asgardienne – des mains d’une toute nouvelle menace, l’impitoyable Hela. Mais d’abord, il doit survivre à une compétition meurtrière de gladiateurs qui l’oppose à son ancien allié et compagnon Avenger – l’Incroyable Hulk !",18000000000.0,High (>100M),85530180600.0,67530180600.0,3.75,True,76,Excellent (8+),https://media.themoviedb.org/t/p/w220_and_h330_face/rzRwTcFvttcN1ZpX2xv4j3tSdJu.jpg,TMDb
Miracle in Cell No. 7,Miracle in Cell No. 7,"Oct 10, 2019",2019,2010s,Drama,132.0,Mehmet Ada Öztekin,"Aras Bulut Iynemli, Nisa Sofiya Aksongur, İlker Aksum, Mesut Akusta, Yıldıray Şahinler",5,"Séparé de sa fille, un père avec un handicap mental doit prouver son innocence lorsqu'il est arrêté pour le meurtre d'une enfant.",,Unknown,2800000000.0,,,,83,Excellent (8+),https://media.themoviedb.org/t/p/w220_and_h330_face/bOth4QmNyEkalwahfPCfiXjNh1r.jpg,TMDb
Joy Division,Joy Division,"Jan 28, 2009",2009,2000s,"Documentary, Music",93.0,Grant Gee,"Anton Corbijn, Ian Curtis, Peter Hook",3,"En 1976, quatre jeunes hommes issus de la post-industrielle Manchester se rendent à un concert des Sex Pistols. Fortement inspirés par ce show auquel ils ont assisté, ils décident de monter un groupe, Joy Division. Près de 30 ans plus tard, malgré une tragédie qui les a arrêtés dans leur élan, Joy Division connaît un succès et une influence plus grande que jamais. Leur héritage résonne tout particulièrement dans une industrie musicale actuelle carriériste et une culture pop surmédiatisée. Grâce à des interviews des membres survivants du groupe, aujourd'hui réunis sous le nom de New Order, et à des archives inédites, Joy Division se fait la chronique d'un changement social et politique en Angleterre et nous entraîne dans l'histoire de ces quatre hommes, qui ont transcendé les barrières économiques et culturelles pour produire une musique atemporelle.",,Unknown,,,,,77,Excellent (8+),https://media.themoviedb.org/t/p/w220_and_h330_face/si2Kgb6NRkIUmI5NfWQH1Y8TBVV.jpg,TMDb
The Truman Show,The Truman Show,"Jun 05, 1998",1998,1990s,"Comedy, Drama",102.0,Peter Weir,"Jim Carrey, Laura Linney, Noah Emmerich, Natascha McElhone, Holland Taylor",5,"Il est la vedette d’un show télévisé - mais il ne le sait pas. Jim Carrey a conquis à la fois les critiques et le public pour sa prestation inoubliable dans ce chef-d'œuvre de Peter Weir. Il interprète Truman Burbank, un homme dont la vie entière est un show télévisé - Ses moindres faits et gestes sont filmés à son insu par un créateur/réalisateur/producteur avant-gardiste : la ville entière est un immense studio de cinéma ; ses voisins, ses collègues, ses amis et même sa femme sont des acteurs professionnels d’Hollywood. Un jour pourtant, Truman se doute de quelque chose. Sa réaction face à cette découverte vous fera rire, pleurer et vous émerveillera comme aucun film ne l’a jamais fait.",6000000000.0,High (>100M),26411871200.0,20411871200.0,3.4,True,82,Excellent (8+),https://media.themoviedb.org/t/p/w220_and_h330_face/vuza0WqY239yBXOadKlGwJsZJFE.jpg,TMDb
The Flash,The Flash,"Jun 16, 2023",2023,2020s,"Action, Adventure",144.0,Bob Kane,"Ezra Miller, Sasha Calle, Michael Keaton, Michael Shannon, Ron Livingston",5,"Les mondes entrent en collision lorsque Barry, alias ""The Flash"", utilise ses pouvoirs pour voyager dans le temps afin de changer les événements du passé. Mais lorsque sa tentative de sauver sa famille modifie par inadvertance le futur, Barry se retrouve piégé dans une réalité où le Général Zod est revenu, avide de destruction, et il n'y a aucun super-héros vers qui se tourner. Enfin, à moins que Barry ne puisse faire sortir un Batman très différent de sa retraite et arrive à sauver un Kryptonien emprisonné… mais pas celui qu'il recherche. En fin de compte, pour sauver le monde dans lequel il se trouve et retourner dans le futur qu'il connaît, le seul espoir de Barry est de foncer. Mais faire le sacrifice ultime suffira-t-il à réinitialiser l'univers ?",22000000000.0,High (>100M),27133331300.0,5133331300.0,0.23,True,66,Excellent (8+),https://media.themoviedb.org/t/p/w220_and_h330_face/rktDFPbfHfUbArZ6OOOKsXcv0Bm.jpg,TMDb
The Hangover,The Hangover,"Jun 05, 2009",2009,2000s,Comedy,95.0,Todd Phillips,"Bradley Cooper, Ed Helms, Zach Galifianakis, Justin Bartha, Heather Graham",5,"Ils avaient prévu un enterrement de vie de garçon à Las Vegas qu’ils n’oublieraient jamais. Maintenant, ils ont vraiment besoin de se souvenir de ce qu’il s’est passé. À qui est ce bébé dans le placard de leur suite au Caesar Palace ? Comment un tigre est‐il arrivé jusque dans leur salle de bain ? Pourquoi manque‐t‐il une dent à l’un d’entre eux ? Et, surtout, où est le marié ? ! Mais ce qu’ils ont fait la nuit précédente n’est rien en comparaison des combines scandaleuses qu’ils doivent mettre en œuvre pour tenter de rassembler les pièces du puzzle qui constituent leur nuit passée – à partir d’indices franchement brumeux…",3500000000.0,High (>100M),46931083600.0,43431083600.0,12.41,True,73,Excellent (8+),https://media.themoviedb.org/t/p/w220_and_h330_face/A0uS9rHR56FeBtpjVki16M5xxSW.jpg,TMDb
The Fifth Element,The Fifth Element,"May 09, 1997",1997,1990s,"Action, Adventure",126.0,Luc Besson,"Bruce Willis, Milla Jovovich, Gary Oldman, Ian Holm, Chris Tucker",5,"New York, XXIIIe siècle. Une boule de feu fonce sur la Terre. Pour l'arrêter il faut retrouver le Cinquième Élément, l'être suprême, qui, associé aux quatre éléments vitaux - l'air, l'eau, le feu et la terre - peut seul repousser Le Mal. Cornélius reçoit l'aide de Korben, taxi et ancien agent secret, et de Leeloo, extraterrestre qui a pris la forme d'une jeune femme aux cheveux oranges.",9000000000.0,High (>100M),26392018000.0,17392018000.0,1.93,True,76,Excellent (8+),https://media.themoviedb.org/t/p/w220_and_h330_face/fPtlCO1yQtnoLHOwKtWz7db6RGU.jpg,TMDb
School of Magical Animals 3,School of Magical Animals 3,"Sep 26, 2024",2024,2020s,"Comedy, Fantasy",100.0,Sven Unterwaldt Jr.,"Emilia Pieske, Loris Sichrovsky, Luis Vorbach, Emilia Maier, Meltem Kaptan",5,"Ida wants to perform with her class at the annual Forest Day to campaign for the protection of the local forest. Even Helene is there, as she hopes to use the footage of the performance to build up her influencer channel. What nobody knows is that Helene's family is on the verge of bankruptcy and Helene urgently needs followers to avert the threat of bankruptcy. Helene is also under pressure from the high expectations of her magical animal, Karajan the cat from Paris, who imagines a life of pure luxury.",,Unknown,2500086900.0,,,,62,Excellent (8+),https://media.themoviedb.org/t/p/w220_and_h330_face/yuwPuKYdXUch49sEb757bNs4t0b.jpg,TMDb
Blade Runner,Blade Runner,"Jun 25, 1982",1982,1980s,"Drama, Thriller",117.0,Ridley Scott,"Harrison Ford, Rutger Hauer, Sean Young, Edward James Olmos, M. Emmet Walsh",5,"2019, Los Angeles. La Terre est surpeuplée et l’humanité est partie coloniser l’espace. Les nouveaux colons sont assistés de Replicants, androïdes que rien ne peut distinguer de l'être humain. Conçus comme de nouveaux esclaves, certains parmi les plus évolués s’affranchissent de leurs chaînes et s’enfuient. Rick Deckard, un ancien Blade Runner, catégorie spéciale de policiers chargés de ""retirer"" ces replicants, accepte une nouvelle mission consistant à retrouver quatre de ces individus qui viennent de regagner la Terre après avoir volé une navette spatiale.",2800000000.0,High (>100M),4172242400.0,1372242400.0,0.49,True,79,Excellent (8+),https://media.themoviedb.org/t/p/w220_and_h330_face/63N9uy8nd9j7Eog2axPQ8lbr3Wj.jpg,TMDb
Die My Love,Die My Love,"Nov 07, 2025",2025,2020s,Drama,118.0,Lynne Ramsay,"Jennifer Lawrence, Robert Pattinson, Sissy Spacek, LaKeith Stanfield, Nick Nolte",5,"Grace et Jackson emménagent dans une vieille maison de campagne. Elle poursuit son rêve d'écriture, et les deux deviennent parents peu de temps après. Cependant, avec les absences de Jackson et les pressions de la vie domestique, Grace commence à sombrer, semant la destruction dans son sillage.",,Unknown,1174593300.0,,,,61,Excellent (8+),https://media.themoviedb.org/t/p/w220_and_h330_face/kajpShbFhOdpl6yCrLezMrr9tB4.jpg,TMDb
The Suicide Squad,The Suicide Squad,"Aug 06, 2021",2021,2020s,"Action, Adventure, Comedy",132.0,James Gunn,"Margot Robbie, Idris Elba, John Cena, Joel Kinnaman, Sylvester Stallone",5,"Bienvenue en enfer - aka Belle Reve, la prison dotée du taux de mortalité le plus élevé des États-Unis d'Amérique. Là où sont détenus les pires super-vilains, qui feront tout pour en sortir - y compris rejoindre la super secrète et la super louche Task Force X. La mission mortelle du jour ? Assemblez une belle collection d'escrocs, et notamment Bloodsport, Peacemaker, Captain Boomerang, Ratcatcher 2, Savant, King Shark, Blackguard, Javelin et la psychopathe préférée de tous : Harley Quinn. Armez-les lourdement et jetez-les (littéralement) sur l'île lointaine et bourrée d'ennemis de Corto Maltese. Traversant une jungle qui grouille d'adversaires et de guerilleros à chaque tournant, l'Escouade est lancée dans une mission de recherche et de destruction, avec le seul Colonel Rick Flag pour les encadrer sur le terrain et la technologie du gouvernement dans leurs oreilles, afin qu'Amanda Waller puisse suivre le moindre de leurs mouvements.",18500000000.0,High (>100M),16871742500.0,-1628257500.0,-0.09,False,75,Excellent (8+),https://media.themoviedb.org/t/p/w220_and_h330_face/q61qEyssk2ku3okWICKArlAdhBn.jpg,TMDb
Babygirl,Babygirl,"Dec 25, 2024",2024,2020s,"Romance, Thriller",114.0,Halina Reijn,"Nicole Kidman, Harris Dickinson, Antonio Banderas, Esther-Rose McGregor, Sophie Wilde",5,"Romy, PDG d’une grande entreprise, a tout pour être heureuse : un mari aimant, deux filles épanouies et une carrière réussie. Mais un jour, elle rencontre un jeune stagiaire dans la société qu’elle dirige à New York. Elle entame avec lui une liaison torride, quitte à tout risquer pour réaliser ses fantasmes les plus enfouis…",2000000000.0,High (>100M),6093489400.0,4093489400.0,2.05,True,57,Excellent (8+),https://media.themoviedb.org/t/p/w220_and_h330_face/ilwO6elz3mLV9CToT7C8pjVeKX0.jpg,TMDb
Encanto,Encanto,"Nov 24, 2021",2021,2020s,"Animation, Comedy, Fantasy",102.0,Jared Bush,"Stephanie Beatriz, María Cecilia Botero, John Leguizamo, Diane Guerrero, Jess Darrow",5,"Dans un mystérieux endroit niché au cœur des montagnes de Colombie, la fantastique famille Madrigal habite une maison enchantée dans une cité pleine de vie, un endroit merveilleux appelé Encanto. L’Encanto a doté chacun des enfants de la famille d’une faculté magique allant d’une force surhumaine au pouvoir de guérison. Seule Mirabel n’a reçu aucun don particulier. Mais lorsque la magie de l’Encanto se trouve menacée, la seule enfant ordinaire de cette famille extraordinaire va peut-être se révéler leur unique espoir…",15000000000.0,High (>100M),26129268800.0,11129268800.0,0.74,True,76,Excellent (8+),https://media.themoviedb.org/t/p/w220_and_h330_face/4j0PNHkMr5ax3IA8tjtxcmPU3QT.jpg,TMDb
